{
    "code": 0,
    "message": "success",
    "invoices": [
        {
            "ach_payment_initiated": false,
            "ach_payment_initiated_formatted": false,
            "invoice_id": "168648000000747001",
            "customer_id": "168648000000111622",
            "customer_name": "aruneshwar",
            "status": "draft",
            "status_formatted": "Draft",
            "invoice_number": "INV-000066",
            "reference_number": "",
            "date": "2024-06-26",
            "date_formatted": "26/06/2024",
            "due_date": "2024-06-26",
            "due_date_formatted": "26/06/2024",
            "due_days": "",
            "type_formatted": "Tax Invoice",
            "type": "invoice",
            "total": 30,
            "total_formatted": "₹30.00",
            "balance": 30,
            "balance_formatted": "₹30.00",
            "created_time": "2024-06-26T06:11:48+0530",
            "created_time_formatted": "26/06/2024 06:11 AM",
            "last_modified_time": "2024-07-30T15:11:56+0530",
            "is_viewed_by_client": false,
            "has_attachment": false,
            "client_viewed_time": "",
            "client_viewed_time_formatted": "",
            "is_emailed": false,
            "schedule_time": "",
            "schedule_time_formatted": "",
            "is_square_transaction": false,
            "is_pre_gst": false,
            "unprocessed_payment_amount": 0,
            "unprocessed_payment_amount_formatted": "₹0.00"
        },
        {
            "ach_payment_initiated": false,
            "ach_payment_initiated_formatted": false,
            "invoice_id": "168648000000370033",
            "customer_id": "168648000000370001",
            "customer_name": "aruneshwar+1",
            "status": "paid",
            "status_formatted": "Paid",
            "invoice_number": "INV-000025",
            "reference_number": "",
            "date": "2023-12-24",
            "date_formatted": "24/12/2023",
            "due_date": "2023-12-24",
            "due_date_formatted": "24/12/2023",
            "due_days": "",
            "type_formatted": "Tax Invoice",
            "type": "invoice",
            "total": 50,
            "total_formatted": "₹50.00",
            "balance": 0,
            "balance_formatted": "₹0.00",
            "created_time": "2023-12-24T17:08:11+0530",
            "created_time_formatted": "24/12/2023 05:08 PM",
            "last_modified_time": "2024-08-26T16:11:07+0530",
            "is_viewed_by_client": true,
            "has_attachment": false,
            "client_viewed_time": "2023-12-24",
            "client_viewed_time_formatted": "24/12/2023 05:12 PM",
            "is_viewed_in_mail": false,
            "is_emailed": true,
            "mail_last_viewed_time": "",
            "mail_last_viewed_time_formatted": "",
            "schedule_time": "",
            "schedule_time_formatted": "",
            "is_square_transaction": false,
            "is_pre_gst": false,
            "unprocessed_payment_amount": 0,
            "unprocessed_payment_amount_formatted": "₹0.00"
        },
        {
            "ach_payment_initiated": false,
            "ach_payment_initiated_formatted": false,
            "invoice_id": "168648000000390001",
            "customer_id": "168648000000370001",
            "customer_name": "aruneshwar+1",
            "status": "paid",
            "status_formatted": "Paid",
            "invoice_number": "INV-000028",
            "reference_number": "",
            "date": "2024-01-02",
            "date_formatted": "02/01/2024",
            "due_date": "2024-01-02",
            "due_date_formatted": "02/01/2024",
            "due_days": "",
            "type_formatted": "Tax Invoice",
            "type": "invoice",
            "total": 50,
            "total_formatted": "₹50.00",
            "balance": 0,
            "balance_formatted": "₹0.00",
            "created_time": "2024-01-02T12:16:01+0530",
            "created_time_formatted": "02/01/2024 12:16 PM",
            "last_modified_time": "2024-08-26T16:11:07+0530",
            "is_viewed_by_client": true,
            "has_attachment": false,
            "client_viewed_time": "2024-01-02",
            "client_viewed_time_formatted": "02/01/2024 12:16 PM",
            "is_viewed_in_mail": false,
            "is_emailed": true,
            "mail_last_viewed_time": "",
            "mail_last_viewed_time_formatted": "",
            "schedule_time": "",
            "schedule_time_formatted": "",
            "is_square_transaction": false,
            "is_pre_gst": false,
            "unprocessed_payment_amount": 0,
            "unprocessed_payment_amount_formatted": "₹0.00"
        },
        {
            "ach_payment_initiated": false,
            "ach_payment_initiated_formatted": false,
            "invoice_id": "168648000000411023",
            "customer_id": "168648000000123001",
            "customer_name": "praveen",
            "status": "draft",
            "status_formatted": "Draft",
            "invoice_number": "INV-000031",
            "reference_number": "",
            "date": "2024-01-10",
            "date_formatted": "10/01/2024",
            "due_date": "2024-01-10",
            "due_date_formatted": "10/01/2024",
            "due_days": "",
            "type_formatted": "Tax Invoice",
            "type": "invoice",
            "total": 50,
            "total_formatted": "₹50.00",
            "balance": 50,
            "balance_formatted": "₹50.00",
            "created_time": "2024-01-10T14:59:35+0530",
            "created_time_formatted": "10/01/2024 02:59 PM",
            "last_modified_time": "2024-01-10T14:59:35+0530",
            "is_viewed_by_client": false,
            "has_attachment": false,
            "client_viewed_time": "",
            "client_viewed_time_formatted": "",
            "is_emailed": false,
            "schedule_time": "",
            "schedule_time_formatted": "",
            "is_square_transaction": false,
            "is_pre_gst": false,
            "unprocessed_payment_amount": 0,
            "unprocessed_payment_amount_formatted": "₹0.00"
        },
        {
            "ach_payment_initiated": false,
            "ach_payment_initiated_formatted": false,
            "invoice_id": "168648000000411047",
            "customer_id": "168648000000111622",
            "customer_name": "aruneshwar",
            "status": "draft",
            "status_formatted": "Draft",
            "invoice_number": "INV-000032",
            "reference_number": "",
            "date": "2024-01-10",
            "date_formatted": "10/01/2024",
            "due_date": "2024-01-10",
            "due_date_formatted": "10/01/2024",
            "due_days": "",
            "type_formatted": "Tax Invoice",
            "type": "invoice",
            "total": 50,
            "total_formatted": "₹50.00",
            "balance": 50,
            "balance_formatted": "₹50.00",
            "created_time": "2024-01-10T15:39:26+0530",
            "created_time_formatted": "10/01/2024 03:39 PM",
            "last_modified_time": "2024-01-10T15:39:26+0530",
            "is_viewed_by_client": false,
            "has_attachment": false,
            "client_viewed_time": "",
            "client_viewed_time_formatted": "",
            "is_emailed": false,
            "schedule_time": "",
            "schedule_time_formatted": "",
            "is_square_transaction": false,
            "is_pre_gst": false,
            "unprocessed_payment_amount": 0,
            "unprocessed_payment_amount_formatted": "₹0.00"
        },
        {
            "ach_payment_initiated": false,
            "ach_payment_initiated_formatted": false,
            "invoice_id": "168648000000723015",
            "customer_id": "168648000000468039",
            "customer_name": "sudharsan",
            "status": "draft",
            "status_formatted": "Draft",
            "invoice_number": "INV-000063",
            "reference_number": "",
            "date": "2024-06-14",
            "date_formatted": "14/06/2024",
            "due_date": "2024-06-14",
            "due_date_formatted": "14/06/2024",
            "due_days": "",
            "type_formatted": "Tax Invoice",
            "type": "invoice",
            "total": 50,
            "total_formatted": "₹50.00",
            "balance": 50,
            "balance_formatted": "₹50.00",
            "created_time": "2024-06-14T11:21:52+0530",
            "created_time_formatted": "14/06/2024 11:21 AM",
            "last_modified_time": "2024-06-14T11:21:52+0530",
            "is_viewed_by_client": false,
            "has_attachment": false,
            "client_viewed_time": "",
            "client_viewed_time_formatted": "",
            "is_emailed": false,
            "schedule_time": "",
            "schedule_time_formatted": "",
            "is_square_transaction": false,
            "is_pre_gst": false,
            "unprocessed_payment_amount": 0,
            "unprocessed_payment_amount_formatted": "₹0.00"
        },
        {
            "ach_payment_initiated": false,
            "ach_payment_initiated_formatted": false,
            "invoice_id": "168648000000735001",
            "customer_id": "168648000000468039",
            "customer_name": "sudharsan",
            "status": "draft",
            "status_formatted": "Draft",
            "invoice_number": "INV-000065",
            "reference_number": "",
            "date": "2024-06-21",
            "date_formatted": "21/06/2024",
            "due_date": "2024-06-21",
            "due_date_formatted": "21/06/2024",
            "due_days": "",
            "type_formatted": "Tax Invoice",
            "type": "invoice",
            "total": 50,
            "total_formatted": "₹50.00",
            "balance": 50,
            "balance_formatted": "₹50.00",
            "created_time": "2024-06-21T06:04:11+0530",
            "created_time_formatted": "21/06/2024 06:04 AM",
            "last_modified_time": "2024-06-21T06:04:13+0530",
            "is_viewed_by_client": false,
            "has_attachment": false,
            "client_viewed_time": "",
            "client_viewed_time_formatted": "",
            "is_emailed": false,
            "schedule_time": "",
            "schedule_time_formatted": "",
            "is_square_transaction": false,
            "is_pre_gst": false,
            "unprocessed_payment_amount": 0,
            "unprocessed_payment_amount_formatted": "₹0.00"
        },
        {
            "ach_payment_initiated": false,
            "ach_payment_initiated_formatted": false,
            "invoice_id": "168648000000750001",
            "customer_id": "168648000000468039",
            "customer_name": "sudharsan",
            "status": "draft",
            "status_formatted": "Draft",
            "invoice_number": "INV-000067",
            "reference_number": "",
            "date": "2024-06-28",
            "date_formatted": "28/06/2024",
            "due_date": "2024-06-28",
            "due_date_formatted": "28/06/2024",
            "due_days": "",
            "type_formatted": "Tax Invoice",
            "type": "invoice",
            "total": 50,
            "total_formatted": "₹50.00",
            "balance": 50,
            "balance_formatted": "₹50.00",
            "created_time": "2024-06-28T06:15:12+0530",
            "created_time_formatted": "28/06/2024 06:15 AM",
            "last_modified_time": "2024-06-28T06:15:13+0530",
            "is_viewed_by_client": false,
            "has_attachment": false,
            "client_viewed_time": "",
            "client_viewed_time_formatted": "",
            "is_emailed": false,
            "schedule_time": "",
            "schedule_time_formatted": "",
            "is_square_transaction": false,
            "is_pre_gst": false,
            "unprocessed_payment_amount": 0,
            "unprocessed_payment_amount_formatted": "₹0.00"
        },
        {
            "ach_payment_initiated": false,
            "ach_payment_initiated_formatted": false,
            "invoice_id": "168648000000769001",
            "customer_id": "168648000000468039",
            "customer_name": "sudharsan",
            "status": "draft",
            "status_formatted": "Draft",
            "invoice_number": "INV-000070",
            "reference_number": "",
            "date": "2024-07-05",
            "date_formatted": "05/07/2024",
            "due_date": "2024-07-05",
            "due_date_formatted": "05/07/2024",
            "due_days": "",
            "type_formatted": "Tax Invoice",
            "type": "invoice",
            "total": 50,
            "total_formatted": "₹50.00",
            "balance": 50,
            "balance_formatted": "₹50.00",
            "created_time": "2024-07-05T06:01:47+0530",
            "created_time_formatted": "05/07/2024 06:01 AM",
            "last_modified_time": "2024-07-05T06:01:48+0530",
            "is_viewed_by_client": false,
            "has_attachment": false,
            "client_viewed_time": "",
            "client_viewed_time_formatted": "",
            "is_emailed": false,
            "schedule_time": "",
            "schedule_time_formatted": "",
            "is_square_transaction": false,
            "is_pre_gst": false,
            "unprocessed_payment_amount": 0,
            "unprocessed_payment_amount_formatted": "₹0.00"
        },
        {
            "ach_payment_initiated": false,
            "ach_payment_initiated_formatted": false,
            "invoice_id": "168648000000781001",
            "customer_id": "168648000000468039",
            "customer_name": "sudharsan",
            "status": "draft",
            "status_formatted": "Draft",
            "invoice_number": "INV-000073",
            "reference_number": "",
            "date": "2024-07-12",
            "date_formatted": "12/07/2024",
            "due_date": "2024-07-12",
            "due_date_formatted": "12/07/2024",
            "due_days": "",
            "type_formatted": "Tax Invoice",
            "type": "invoice",
            "total": 50,
            "total_formatted": "₹50.00",
            "balance": 50,
            "balance_formatted": "₹50.00",
            "created_time": "2024-07-12T06:21:07+0530",
            "created_time_formatted": "12/07/2024 06:21 AM",
            "last_modified_time": "2024-07-12T06:21:09+0530",
            "is_viewed_by_client": false,
            "has_attachment": false,
            "client_viewed_time": "",
            "client_viewed_time_formatted": "",
            "is_emailed": false,
            "schedule_time": "",
            "schedule_time_formatted": "",
            "is_square_transaction": false,
            "is_pre_gst": false,
            "unprocessed_payment_amount": 0,
            "unprocessed_payment_amount_formatted": "₹0.00"
        },
        {
            "ach_payment_initiated": false,
            "ach_payment_initiated_formatted": false,
            "invoice_id": "168648000000794001",
            "customer_id": "168648000000468039",
            "customer_name": "sudharsan",
            "status": "draft",
            "status_formatted": "Draft",
            "invoice_number": "INV-000075",
            "reference_number": "",
            "date": "2024-07-19",
            "date_formatted": "19/07/2024",
            "due_date": "2024-07-19",
            "due_date_formatted": "19/07/2024",
            "due_days": "",
            "type_formatted": "Tax Invoice",
            "type": "invoice",
            "total": 50,
            "total_formatted": "₹50.00",
            "balance": 50,
            "balance_formatted": "₹50.00",
            "created_time": "2024-07-19T06:15:50+0530",
            "created_time_formatted": "19/07/2024 06:15 AM",
            "last_modified_time": "2024-08-21T13:19:33+0530",
            "is_viewed_by_client": false,
            "has_attachment": false,
            "client_viewed_time": "",
            "client_viewed_time_formatted": "",
            "is_emailed": false,
            "schedule_time": "",
            "schedule_time_formatted": "",
            "is_square_transaction": false,
            "is_pre_gst": false,
            "unprocessed_payment_amount": 0,
            "unprocessed_payment_amount_formatted": "₹0.00"
        },
        {
            "ach_payment_initiated": false,
            "ach_payment_initiated_formatted": false,
            "invoice_id": "168648000001000075",
            "customer_id": "168648000000370001",
            "customer_name": "aruneshwar+1",
            "status": "pending_approval",
            "status_formatted": "Pending Approval",
            "invoice_number": "INV-000081",
            "reference_number": "",
            "date": "2024-10-22",
            "date_formatted": "22/10/2024",
            "due_date": "2024-10-22",
            "due_date_formatted": "22/10/2024",
            "due_days": "",
            "type_formatted": "Tax Invoice",
            "type": "invoice",
            "total": 50,
            "total_formatted": "₹50.00",
            "balance": 50,
            "balance_formatted": "₹50.00",
            "created_time": "2024-10-22T21:21:01+0530",
            "created_time_formatted": "22/10/2024 09:21 PM",
            "last_modified_time": "2024-11-05T09:13:25+0530",
            "is_viewed_by_client": false,
            "has_attachment": false,
            "client_viewed_time": "",
            "client_viewed_time_formatted": "",
            "is_emailed": false,
            "schedule_time": "",
            "schedule_time_formatted": "",
            "is_square_transaction": false,
            "is_pre_gst": false,
            "unprocessed_payment_amount": 0,
            "unprocessed_payment_amount_formatted": "₹0.00"
        },
        {
            "ach_payment_initiated": false,
            "ach_payment_initiated_formatted": false,
            "invoice_id": "168648000001000107",
            "customer_id": "168648000000370001",
            "customer_name": "aruneshwar+1",
            "status": "pending_approval",
            "status_formatted": "Pending Approval",
            "invoice_number": "INV-000082",
            "reference_number": "",
            "date": "2024-10-22",
            "date_formatted": "22/10/2024",
            "due_date": "2024-10-22",
            "due_date_formatted": "22/10/2024",
            "due_days": "",
            "type_formatted": "Tax Invoice",
            "type": "invoice",
            "total": 50,
            "total_formatted": "₹50.00",
            "balance": 50,
            "balance_formatted": "₹50.00",
            "created_time": "2024-10-22T21:28:39+0530",
            "created_time_formatted": "22/10/2024 09:28 PM",
            "last_modified_time": "2024-11-05T09:14:04+0530",
            "is_viewed_by_client": false,
            "has_attachment": false,
            "client_viewed_time": "",
            "client_viewed_time_formatted": "",
            "is_emailed": false,
            "schedule_time": "",
            "schedule_time_formatted": "",
            "is_square_transaction": false,
            "is_pre_gst": false,
            "unprocessed_payment_amount": 0,
            "unprocessed_payment_amount_formatted": "₹0.00"
        },
        {
            "ach_payment_initiated": false,
            "ach_payment_initiated_formatted": false,
            "invoice_id": "168648000001007049",
            "customer_id": "168648000000111622",
            "customer_name": "aruneshwar",
            "status": "draft",
            "status_formatted": "Draft",
            "invoice_number": "INV-000084",
            "reference_number": "",
            "date": "2024-10-24",
            "date_formatted": "24/10/2024",
            "due_date": "2024-10-24",
            "due_date_formatted": "24/10/2024",
            "due_days": "",
            "type_formatted": "Tax Invoice",
            "type": "invoice",
            "total": 50,
            "total_formatted": "₹50.00",
            "balance": 50,
            "balance_formatted": "₹50.00",
            "created_time": "2024-10-24T17:59:23+0530",
            "created_time_formatted": "24/10/2024 05:59 PM",
            "last_modified_time": "2024-10-24T17:59:23+0530",
            "is_viewed_by_client": false,
            "has_attachment": false,
            "client_viewed_time": "",
            "client_viewed_time_formatted": "",
            "is_emailed": false,
            "schedule_time": "",
            "schedule_time_formatted": "",
            "is_square_transaction": false,
            "is_pre_gst": false,
            "unprocessed_payment_amount": 0,
            "unprocessed_payment_amount_formatted": "₹0.00"
        },
        {
            "ach_payment_initiated": false,
            "ach_payment_initiated_formatted": false,
            "invoice_id": "168648000001007075",
            "customer_id": "168648000000111622",
            "customer_name": "aruneshwar",
            "status": "approved",
            "status_formatted": "Approved",
            "invoice_number": "INV-000085",
            "reference_number": "",
            "date": "2024-10-24",
            "date_formatted": "24/10/2024",
            "due_date": "2024-10-24",
            "due_date_formatted": "24/10/2024",
            "due_days": "",
            "type_formatted": "Tax Invoice",
            "type": "invoice",
            "total": 50,
            "total_formatted": "₹50.00",
            "balance": 50,
            "balance_formatted": "₹50.00",
            "created_time": "2024-10-24T18:12:47+0530",
            "created_time_formatted": "24/10/2024 06:12 PM",
            "last_modified_time": "2025-01-28T17:42:03+0530",
            "is_viewed_by_client": false,
            "has_attachment": false,
            "client_viewed_time": "",
            "client_viewed_time_formatted": "",
            "is_emailed": false,
            "schedule_time": "",
            "schedule_time_formatted": "",
            "is_square_transaction": false,
            "is_pre_gst": false,
            "unprocessed_payment_amount": 0,
            "unprocessed_payment_amount_formatted": "₹0.00"
        },
        {
            "ach_payment_initiated": false,
            "ach_payment_initiated_formatted": false,
            "invoice_id": "168648000002254031",
            "customer_id": "168648000000111622",
            "customer_name": "aruneshwar",
            "status": "draft",
            "status_formatted": "Draft",
            "invoice_number": "123456",
            "reference_number": "",
            "date": "2025-10-09",
            "date_formatted": "09/10/2025",
            "due_date": "2025-10-09",
            "due_date_formatted": "09/10/2025",
            "due_days": "",
            "type_formatted": "Tax Invoice",
            "type": "invoice",
            "total": 50,
            "total_formatted": "₹50.00",
            "balance": 50,
            "balance_formatted": "₹50.00",
            "created_time": "2025-10-09T10:27:12+0530",
            "created_time_formatted": "09/10/2025 10:27 AM",
            "last_modified_time": "2025-10-09T11:04:14+0530",
            "is_viewed_by_client": false,
            "has_attachment": false,
            "client_viewed_time": "",
            "client_viewed_time_formatted": "",
            "is_emailed": false,
            "schedule_time": "",
            "schedule_time_formatted": "",
            "is_square_transaction": false,
            "is_pre_gst": false,
            "unprocessed_payment_amount": 0,
            "unprocessed_payment_amount_formatted": "₹0.00"
        },
        {
            "ach_payment_initiated": false,
            "ach_payment_initiated_formatted": false,
            "invoice_id": "168648000001007015",
            "customer_id": "168648000000370001",
            "customer_name": "aruneshwar+1",
            "status": "pending_approval",
            "status_formatted": "Pending Approval",
            "invoice_number": "INV-000083",
            "reference_number": "",
            "date": "2024-10-24",
            "date_formatted": "24/10/2024",
            "due_date": "2024-10-24",
            "due_date_formatted": "24/10/2024",
            "due_days": "",
            "type_formatted": "Tax Invoice",
            "type": "invoice",
            "total": 52.5,
            "total_formatted": "₹52.50",
            "balance": 52.5,
            "balance_formatted": "₹52.50",
            "created_time": "2024-10-24T17:48:45+0530",
            "created_time_formatted": "24/10/2024 05:48 PM",
            "last_modified_time": "2024-11-05T09:14:12+0530",
            "is_viewed_by_client": false,
            "has_attachment": false,
            "client_viewed_time": "",
            "client_viewed_time_formatted": "",
            "is_emailed": false,
            "schedule_time": "",
            "schedule_time_formatted": "",
            "is_square_transaction": false,
            "is_pre_gst": false,
            "unprocessed_payment_amount": 0,
            "unprocessed_payment_amount_formatted": "₹0.00"
        },
        {
            "ach_payment_initiated": false,
            "ach_payment_initiated_formatted": false,
            "invoice_id": "168648000001007107",
            "customer_id": "168648000000370001",
            "customer_name": "aruneshwar+1",
            "status": "approved",
            "status_formatted": "Approved",
            "invoice_number": "INV-000086",
            "reference_number": "",
            "date": "2024-10-24",
            "date_formatted": "24/10/2024",
            "due_date": "2024-10-24",
            "due_date_formatted": "24/10/2024",
            "due_days": "",
            "type_formatted": "Tax Invoice",
            "type": "invoice",
            "total": 56,
            "total_formatted": "₹56.00",
            "balance": 56,
            "balance_formatted": "₹56.00",
            "created_time": "2024-10-24T18:14:55+0530",
            "created_time_formatted": "24/10/2024 06:14 PM",
            "last_modified_time": "2025-08-18T14:57:51+0530",
            "is_viewed_by_client": false,
            "has_attachment": false,
            "client_viewed_time": "",
            "client_viewed_time_formatted": "",
            "is_emailed": false,
            "schedule_time": "",
            "schedule_time_formatted": "",
            "is_square_transaction": false,
            "is_pre_gst": false,
            "unprocessed_payment_amount": 0,
            "unprocessed_payment_amount_formatted": "₹0.00"
        },
        {
            "ach_payment_initiated": false,
            "ach_payment_initiated_formatted": false,
            "invoice_id": "168648000001007131",
            "customer_id": "168648000000111622",
            "customer_name": "aruneshwar",
            "status": "draft",
            "status_formatted": "Draft",
            "invoice_number": "INV-000087",
            "reference_number": "",
            "date": "2024-10-24",
            "date_formatted": "24/10/2024",
            "due_date": "2024-10-24",
            "due_date_formatted": "24/10/2024",
            "due_days": "",
            "type_formatted": "Tax Invoice",
            "type": "invoice",
            "total": 56,
            "total_formatted": "₹56.00",
            "balance": 56,
            "balance_formatted": "₹56.00",
            "created_time": "2024-10-24T18:15:48+0530",
            "created_time_formatted": "24/10/2024 06:15 PM",
            "last_modified_time": "2025-05-16T17:58:51+0530",
            "is_viewed_by_client": false,
            "has_attachment": false,
            "client_viewed_time": "",
            "client_viewed_time_formatted": "",
            "is_emailed": false,
            "schedule_time": "",
            "schedule_time_formatted": "",
            "is_square_transaction": false,
            "is_pre_gst": false,
            "unprocessed_payment_amount": 0,
            "unprocessed_payment_amount_formatted": "₹0.00"
        },
        {
            "ach_payment_initiated": false,
            "ach_payment_initiated_formatted": false,
            "invoice_id": "168648000002897037",
            "customer_id": "168648000000370001",
            "customer_name": "aruneshwar+1",
            "status": "draft",
            "status_formatted": "Draft",
            "invoice_number": "909423",
            "reference_number": "",
            "date": "2026-01-05",
            "date_formatted": "05/01/2026",
            "due_date": "2026-01-05",
            "due_date_formatted": "05/01/2026",
            "due_days": "",
            "type_formatted": "Tax Invoice",
            "type": "invoice",
            "total": 100,
            "total_formatted": "₹100.00",
            "balance": 100,
            "balance_formatted": "₹100.00",
            "created_time": "2026-01-05T12:36:03+0530",
            "created_time_formatted": "05/01/2026 12:36 PM",
            "last_modified_time": "2026-01-05T12:36:03+0530",
            "is_viewed_by_client": false,
            "has_attachment": false,
            "client_viewed_time": "",
            "client_viewed_time_formatted": "",
            "is_emailed": false,
            "schedule_time": "",
            "schedule_time_formatted": "",
            "is_square_transaction": false,
            "is_pre_gst": false,
            "unprocessed_payment_amount": 0,
            "unprocessed_payment_amount_formatted": "₹0.00"
        },
        {
            "ach_payment_initiated": false,
            "ach_payment_initiated_formatted": false,
            "invoice_id": "168648000000111580",
            "customer_id": "168648000000111553",
            "customer_name": "customer 1",
            "status": "pending_approval",
            "status_formatted": "Pending Approval",
            "invoice_number": "INV-000001",
            "reference_number": "",
            "date": "2023-07-24",
            "date_formatted": "24/07/2023",
            "due_date": "2023-07-24",
            "due_date_formatted": "24/07/2023",
            "due_days": "",
            "type_formatted": "Tax Invoice",
            "type": "invoice",
            "total": 110,
            "total_formatted": "₹110.00",
            "balance": 110,
            "balance_formatted": "₹110.00",
            "created_time": "2023-07-24T17:23:09+0530",
            "created_time_formatted": "24/07/2023 05:23 PM",
            "last_modified_time": "2024-12-16T12:30:27+0530",
            "is_viewed_by_client": false,
            "has_attachment": false,
            "client_viewed_time": "",
            "client_viewed_time_formatted": "",
            "is_emailed": false,
            "schedule_time": "",
            "schedule_time_formatted": "",
            "is_square_transaction": false,
            "is_pre_gst": false,
            "unprocessed_payment_amount": 0,
            "unprocessed_payment_amount_formatted": "₹0.00"
        },
        {
            "ach_payment_initiated": false,
            "ach_payment_initiated_formatted": false,
            "invoice_id": "168648000000963042",
            "customer_id": "168648000000111622",
            "customer_name": "aruneshwar",
            "status": "overdue",
            "status_formatted": "Overdue",
            "invoice_number": "INV-000079",
            "reference_number": "",
            "date": "2024-10-10",
            "date_formatted": "10/10/2024",
            "due_date": "2024-10-10",
            "due_date_formatted": "10/10/2024",
            "due_days": "Overdue by 475 days",
            "type_formatted": "Tax Invoice",
            "type": "invoice",
            "total": 250,
            "total_formatted": "₹250.00",
            "balance": 250,
            "balance_formatted": "₹250.00",
            "created_time": "2024-10-10T12:46:08+0530",
            "created_time_formatted": "10/10/2024 12:46 PM",
            "last_modified_time": "2024-10-16T15:22:56+0530",
            "is_viewed_by_client": false,
            "has_attachment": false,
            "client_viewed_time": "",
            "client_viewed_time_formatted": "",
            "is_emailed": false,
            "schedule_time": "",
            "schedule_time_formatted": "",
            "is_square_transaction": false,
            "is_pre_gst": false,
            "unprocessed_payment_amount": 0,
            "unprocessed_payment_amount_formatted": "₹0.00"
        },
        {
            "ach_payment_initiated": false,
            "ach_payment_initiated_formatted": false,
            "invoice_id": "168648000000989003",
            "customer_id": "168648000000111622",
            "customer_name": "aruneshwar",
            "status": "overdue",
            "status_formatted": "Overdue",
            "invoice_number": "INV-000080",
            "reference_number": "",
            "date": "2024-10-18",
            "date_formatted": "18/10/2024",
            "due_date": "2024-10-18",
            "due_date_formatted": "18/10/2024",
            "due_days": "Overdue by 467 days",
            "type_formatted": "Tax Invoice",
            "type": "invoice",
            "total": 250,
            "total_formatted": "₹250.00",
            "balance": 250,
            "balance_formatted": "₹250.00",
            "created_time": "2024-10-18T14:43:59+0530",
            "created_time_formatted": "18/10/2024 02:43 PM",
            "last_modified_time": "2024-10-18T15:25:44+0530",
            "is_viewed_by_client": false,
            "has_attachment": false,
            "client_viewed_time": "",
            "client_viewed_time_formatted": "",
            "is_emailed": false,
            "schedule_time": "",
            "schedule_time_formatted": "",
            "is_square_transaction": false,
            "is_pre_gst": false,
            "unprocessed_payment_amount": 0,
            "unprocessed_payment_amount_formatted": "₹0.00"
        },
        {
            "ach_payment_initiated": false,
            "ach_payment_initiated_formatted": false,
            "invoice_id": "168648000000123023",
            "customer_id": "168648000000111622",
            "customer_name": "aruneshwar",
            "status": "void",
            "status_formatted": "Void",
            "invoice_number": "INV-000003",
            "reference_number": "",
            "date": "2023-07-31",
            "date_formatted": "31/07/2023",
            "due_date": "2023-07-31",
            "due_date_formatted": "31/07/2023",
            "due_days": "",
            "type_formatted": "Tax Invoice",
            "type": "invoice",
            "total": 300,
            "total_formatted": "₹300.00",
            "balance": 300,
            "balance_formatted": "₹300.00",
            "created_time": "2023-07-31T11:04:31+0530",
            "created_time_formatted": "31/07/2023 11:04 AM",
            "last_modified_time": "2024-11-22T10:51:14+0530",
            "is_viewed_by_client": false,
            "has_attachment": false,
            "client_viewed_time": "",
            "client_viewed_time_formatted": "",
            "is_emailed": false,
            "schedule_time": "",
            "schedule_time_formatted": "",
            "is_square_transaction": false,
            "is_pre_gst": false,
            "unprocessed_payment_amount": 0,
            "unprocessed_payment_amount_formatted": "₹0.00"
        },
        {
            "ach_payment_initiated": false,
            "ach_payment_initiated_formatted": false,
            "invoice_id": "168648000000139031",
            "customer_id": "168648000000111622",
            "customer_name": "aruneshwar",
            "status": "draft",
            "status_formatted": "Draft",
            "invoice_number": "INV-000004",
            "reference_number": "",
            "date": "2023-08-09",
            "date_formatted": "09/08/2023",
            "due_date": "2023-08-09",
            "due_date_formatted": "09/08/2023",
            "due_days": "",
            "type_formatted": "Tax Invoice",
            "type": "invoice",
            "total": 300,
            "total_formatted": "₹300.00",
            "balance": 300,
            "balance_formatted": "₹300.00",
            "created_time": "2023-08-09T12:34:56+0530",
            "created_time_formatted": "09/08/2023 12:34 PM",
            "last_modified_time": "2023-08-09T12:34:56+0530",
            "is_viewed_by_client": false,
            "has_attachment": false,
            "client_viewed_time": "",
            "client_viewed_time_formatted": "",
            "is_emailed": false,
            "schedule_time": "",
            "schedule_time_formatted": "",
            "is_square_transaction": false,
            "is_pre_gst": false,
            "unprocessed_payment_amount": 0,
            "unprocessed_payment_amount_formatted": "₹0.00"
        },
        {
            "ach_payment_initiated": false,
            "ach_payment_initiated_formatted": false,
            "invoice_id": "168648000000150003",
            "customer_id": "168648000000111622",
            "customer_name": "aruneshwar",
            "status": "draft",
            "status_formatted": "Draft",
            "invoice_number": "INV-000005",
            "reference_number": "",
            "date": "2023-08-16",
            "date_formatted": "16/08/2023",
            "due_date": "2023-08-16",
            "due_date_formatted": "16/08/2023",
            "due_days": "",
            "type_formatted": "Tax Invoice",
            "type": "invoice",
            "total": 300,
            "total_formatted": "₹300.00",
            "balance": 300,
            "balance_formatted": "₹300.00",
            "created_time": "2023-08-16T06:16:52+0530",
            "created_time_formatted": "16/08/2023 06:16 AM",
            "last_modified_time": "2023-08-16T06:16:53+0530",
            "is_viewed_by_client": false,
            "has_attachment": false,
            "client_viewed_time": "",
            "client_viewed_time_formatted": "",
            "is_emailed": false,
            "schedule_time": "",
            "schedule_time_formatted": "",
            "is_square_transaction": false,
            "is_pre_gst": false,
            "unprocessed_payment_amount": 0,
            "unprocessed_payment_amount_formatted": "₹0.00"
        },
        {
            "ach_payment_initiated": false,
            "ach_payment_initiated_formatted": false,
            "invoice_id": "168648000000158001",
            "customer_id": "168648000000111622",
            "customer_name": "aruneshwar",
            "status": "draft",
            "status_formatted": "Draft",
            "invoice_number": "INV-000006",
            "reference_number": "",
            "date": "2023-08-23",
            "date_formatted": "23/08/2023",
            "due_date": "2023-08-23",
            "due_date_formatted": "23/08/2023",
            "due_days": "",
            "type_formatted": "Tax Invoice",
            "type": "invoice",
            "total": 300,
            "total_formatted": "₹300.00",
            "balance": 300,
            "balance_formatted": "₹300.00",
            "created_time": "2023-08-23T06:02:04+0530",
            "created_time_formatted": "23/08/2023 06:02 AM",
            "last_modified_time": "2023-08-23T06:02:05+0530",
            "is_viewed_by_client": false,
            "has_attachment": false,
            "client_viewed_time": "",
            "client_viewed_time_formatted": "",
            "is_emailed": false,
            "schedule_time": "",
            "schedule_time_formatted": "",
            "is_square_transaction": false,
            "is_pre_gst": false,
            "unprocessed_payment_amount": 0,
            "unprocessed_payment_amount_formatted": "₹0.00"
        },
        {
            "ach_payment_initiated": false,
            "ach_payment_initiated_formatted": false,
            "invoice_id": "168648000000167001",
            "customer_id": "168648000000111622",
            "customer_name": "aruneshwar",
            "status": "draft",
            "status_formatted": "Draft",
            "invoice_number": "INV-000007",
            "reference_number": "",
            "date": "2023-08-30",
            "date_formatted": "30/08/2023",
            "due_date": "2023-08-30",
            "due_date_formatted": "30/08/2023",
            "due_days": "",
            "type_formatted": "Tax Invoice",
            "type": "invoice",
            "total": 300,
            "total_formatted": "₹300.00",
            "balance": 300,
            "balance_formatted": "₹300.00",
            "created_time": "2023-08-30T06:25:41+0530",
            "created_time_formatted": "30/08/2023 06:25 AM",
            "last_modified_time": "2023-08-30T06:25:42+0530",
            "is_viewed_by_client": false,
            "has_attachment": false,
            "client_viewed_time": "",
            "client_viewed_time_formatted": "",
            "is_emailed": false,
            "schedule_time": "",
            "schedule_time_formatted": "",
            "is_square_transaction": false,
            "is_pre_gst": false,
            "unprocessed_payment_amount": 0,
            "unprocessed_payment_amount_formatted": "₹0.00"
        },
        {
            "ach_payment_initiated": false,
            "ach_payment_initiated_formatted": false,
            "invoice_id": "168648000000183001",
            "customer_id": "168648000000111622",
            "customer_name": "aruneshwar",
            "status": "draft",
            "status_formatted": "Draft",
            "invoice_number": "INV-000008",
            "reference_number": "",
            "date": "2023-09-06",
            "date_formatted": "06/09/2023",
            "due_date": "2023-09-06",
            "due_date_formatted": "06/09/2023",
            "due_days": "",
            "type_formatted": "Tax Invoice",
            "type": "invoice",
            "total": 300,
            "total_formatted": "₹300.00",
            "balance": 300,
            "balance_formatted": "₹300.00",
            "created_time": "2023-09-06T06:19:26+0530",
            "created_time_formatted": "06/09/2023 06:19 AM",
            "last_modified_time": "2023-09-06T06:19:27+0530",
            "is_viewed_by_client": false,
            "has_attachment": false,
            "client_viewed_time": "",
            "client_viewed_time_formatted": "",
            "is_emailed": false,
            "schedule_time": "",
            "schedule_time_formatted": "",
            "is_square_transaction": false,
            "is_pre_gst": false,
            "unprocessed_payment_amount": 0,
            "unprocessed_payment_amount_formatted": "₹0.00"
        },
        {
            "ach_payment_initiated": false,
            "ach_payment_initiated_formatted": false,
            "invoice_id": "168648000000195001",
            "customer_id": "168648000000111622",
            "customer_name": "aruneshwar",
            "status": "draft",
            "status_formatted": "Draft",
            "invoice_number": "INV-000009",
            "reference_number": "",
            "date": "2023-09-13",
            "date_formatted": "13/09/2023",
            "due_date": "2023-09-13",
            "due_date_formatted": "13/09/2023",
            "due_days": "",
            "type_formatted": "Tax Invoice",
            "type": "invoice",
            "total": 300,
            "total_formatted": "₹300.00",
            "balance": 300,
            "balance_formatted": "₹300.00",
            "created_time": "2023-09-13T06:12:27+0530",
            "created_time_formatted": "13/09/2023 06:12 AM",
            "last_modified_time": "2023-09-13T06:12:28+0530",
            "is_viewed_by_client": false,
            "has_attachment": false,
            "client_viewed_time": "",
            "client_viewed_time_formatted": "",
            "is_emailed": false,
            "schedule_time": "",
            "schedule_time_formatted": "",
            "is_square_transaction": false,
            "is_pre_gst": false,
            "unprocessed_payment_amount": 0,
            "unprocessed_payment_amount_formatted": "₹0.00"
        },
        {
            "ach_payment_initiated": false,
            "ach_payment_initiated_formatted": false,
            "invoice_id": "168648000000203005",
            "customer_id": "168648000000111622",
            "customer_name": "aruneshwar",
            "status": "draft",
            "status_formatted": "Draft",
            "invoice_number": "INV-000010",
            "reference_number": "",
            "date": "2023-09-20",
            "date_formatted": "20/09/2023",
            "due_date": "2023-09-20",
            "due_date_formatted": "20/09/2023",
            "due_days": "",
            "type_formatted": "Tax Invoice",
            "type": "invoice",
            "total": 300,
            "total_formatted": "₹300.00",
            "balance": 300,
            "balance_formatted": "₹300.00",
            "created_time": "2023-09-20T06:07:16+0530",
            "created_time_formatted": "20/09/2023 06:07 AM",
            "last_modified_time": "2023-09-20T06:07:17+0530",
            "is_viewed_by_client": false,
            "has_attachment": false,
            "client_viewed_time": "",
            "client_viewed_time_formatted": "",
            "is_emailed": false,
            "schedule_time": "",
            "schedule_time_formatted": "",
            "is_square_transaction": false,
            "is_pre_gst": false,
            "unprocessed_payment_amount": 0,
            "unprocessed_payment_amount_formatted": "₹0.00"
        },
        {
            "ach_payment_initiated": false,
            "ach_payment_initiated_formatted": false,
            "invoice_id": "168648000000213001",
            "customer_id": "168648000000111622",
            "customer_name": "aruneshwar",
            "status": "draft",
            "status_formatted": "Draft",
            "invoice_number": "INV-000011",
            "reference_number": "",
            "date": "2023-09-27",
            "date_formatted": "27/09/2023",
            "due_date": "2023-09-27",
            "due_date_formatted": "27/09/2023",
            "due_days": "",
            "type_formatted": "Tax Invoice",
            "type": "invoice",
            "total": 300,
            "total_formatted": "₹300.00",
            "balance": 300,
            "balance_formatted": "₹300.00",
            "created_time": "2023-09-27T06:13:48+0530",
            "created_time_formatted": "27/09/2023 06:13 AM",
            "last_modified_time": "2023-09-27T06:13:49+0530",
            "is_viewed_by_client": false,
            "has_attachment": false,
            "client_viewed_time": "",
            "client_viewed_time_formatted": "",
            "is_emailed": false,
            "schedule_time": "",
            "schedule_time_formatted": "",
            "is_square_transaction": false,
            "is_pre_gst": false,
            "unprocessed_payment_amount": 0,
            "unprocessed_payment_amount_formatted": "₹0.00"
        },
        {
            "ach_payment_initiated": false,
            "ach_payment_initiated_formatted": false,
            "invoice_id": "168648000000219001",
            "customer_id": "168648000000111622",
            "customer_name": "aruneshwar",
            "status": "draft",
            "status_formatted": "Draft",
            "invoice_number": "INV-000012",
            "reference_number": "",
            "date": "2023-10-04",
            "date_formatted": "04/10/2023",
            "due_date": "2023-10-04",
            "due_date_formatted": "04/10/2023",
            "due_days": "",
            "type_formatted": "Tax Invoice",
            "type": "invoice",
            "total": 300,
            "total_formatted": "₹300.00",
            "balance": 300,
            "balance_formatted": "₹300.00",
            "created_time": "2023-10-04T06:14:00+0530",
            "created_time_formatted": "04/10/2023 06:14 AM",
            "last_modified_time": "2023-10-04T06:14:01+0530",
            "is_viewed_by_client": false,
            "has_attachment": false,
            "client_viewed_time": "",
            "client_viewed_time_formatted": "",
            "is_emailed": false,
            "schedule_time": "",
            "schedule_time_formatted": "",
            "is_square_transaction": false,
            "is_pre_gst": false,
            "unprocessed_payment_amount": 0,
            "unprocessed_payment_amount_formatted": "₹0.00"
        },
        {
            "ach_payment_initiated": false,
            "ach_payment_initiated_formatted": false,
            "invoice_id": "168648000000229001",
            "customer_id": "168648000000111622",
            "customer_name": "aruneshwar",
            "status": "overdue",
            "status_formatted": "Overdue",
            "invoice_number": "INV-000013",
            "reference_number": "",
            "date": "2023-10-11",
            "date_formatted": "11/10/2023",
            "due_date": "2023-10-11",
            "due_date_formatted": "11/10/2023",
            "due_days": "Overdue by 840 days",
            "type_formatted": "Tax Invoice",
            "type": "invoice",
            "total": 300,
            "total_formatted": "₹300.00",
            "balance": 300,
            "balance_formatted": "₹300.00",
            "created_time": "2023-10-11T06:25:09+0530",
            "created_time_formatted": "11/10/2023 06:25 AM",
            "last_modified_time": "2023-11-30T12:30:33+0530",
            "is_viewed_by_client": false,
            "has_attachment": false,
            "client_viewed_time": "",
            "client_viewed_time_formatted": "",
            "is_viewed_in_mail": false,
            "is_emailed": true,
            "mail_last_viewed_time": "",
            "mail_last_viewed_time_formatted": "",
            "schedule_time": "",
            "schedule_time_formatted": "",
            "is_square_transaction": false,
            "is_pre_gst": false,
            "unprocessed_payment_amount": 0,
            "unprocessed_payment_amount_formatted": "₹0.00"
        },
        {
            "ach_payment_initiated": false,
            "ach_payment_initiated_formatted": false,
            "invoice_id": "168648000000236001",
            "customer_id": "168648000000111622",
            "customer_name": "aruneshwar",
            "status": "draft",
            "status_formatted": "Draft",
            "invoice_number": "INV-000014",
            "reference_number": "",
            "date": "2023-10-18",
            "date_formatted": "18/10/2023",
            "due_date": "2023-10-18",
            "due_date_formatted": "18/10/2023",
            "due_days": "",
            "type_formatted": "Tax Invoice",
            "type": "invoice",
            "total": 300,
            "total_formatted": "₹300.00",
            "balance": 300,
            "balance_formatted": "₹300.00",
            "created_time": "2023-10-18T06:30:45+0530",
            "created_time_formatted": "18/10/2023 06:30 AM",
            "last_modified_time": "2023-10-18T06:30:46+0530",
            "is_viewed_by_client": false,
            "has_attachment": false,
            "client_viewed_time": "",
            "client_viewed_time_formatted": "",
            "is_emailed": false,
            "schedule_time": "",
            "schedule_time_formatted": "",
            "is_square_transaction": false,
            "is_pre_gst": false,
            "unprocessed_payment_amount": 0,
            "unprocessed_payment_amount_formatted": "₹0.00"
        },
        {
            "ach_payment_initiated": false,
            "ach_payment_initiated_formatted": false,
            "invoice_id": "168648000000243001",
            "customer_id": "168648000000111622",
            "customer_name": "aruneshwar",
            "status": "draft",
            "status_formatted": "Draft",
            "invoice_number": "INV-000015",
            "reference_number": "",
            "date": "2023-10-25",
            "date_formatted": "25/10/2023",
            "due_date": "2023-10-25",
            "due_date_formatted": "25/10/2023",
            "due_days": "",
            "type_formatted": "Tax Invoice",
            "type": "invoice",
            "total": 300,
            "total_formatted": "₹300.00",
            "balance": 300,
            "balance_formatted": "₹300.00",
            "created_time": "2023-10-25T06:10:51+0530",
            "created_time_formatted": "25/10/2023 06:10 AM",
            "last_modified_time": "2023-10-25T06:10:52+0530",
            "is_viewed_by_client": false,
            "has_attachment": false,
            "client_viewed_time": "",
            "client_viewed_time_formatted": "",
            "is_emailed": false,
            "schedule_time": "",
            "schedule_time_formatted": "",
            "is_square_transaction": false,
            "is_pre_gst": false,
            "unprocessed_payment_amount": 0,
            "unprocessed_payment_amount_formatted": "₹0.00"
        },
        {
            "ach_payment_initiated": false,
            "ach_payment_initiated_formatted": false,
            "invoice_id": "168648000000252001",
            "customer_id": "168648000000111622",
            "customer_name": "aruneshwar",
            "status": "draft",
            "status_formatted": "Draft",
            "invoice_number": "INV-000016",
            "reference_number": "",
            "date": "2023-11-01",
            "date_formatted": "01/11/2023",
            "due_date": "2023-11-01",
            "due_date_formatted": "01/11/2023",
            "due_days": "",
            "type_formatted": "Tax Invoice",
            "type": "invoice",
            "total": 300,
            "total_formatted": "₹300.00",
            "balance": 300,
            "balance_formatted": "₹300.00",
            "created_time": "2023-11-01T06:19:17+0530",
            "created_time_formatted": "01/11/2023 06:19 AM",
            "last_modified_time": "2023-11-01T06:19:18+0530",
            "is_viewed_by_client": false,
            "has_attachment": false,
            "client_viewed_time": "",
            "client_viewed_time_formatted": "",
            "is_emailed": false,
            "schedule_time": "",
            "schedule_time_formatted": "",
            "is_square_transaction": false,
            "is_pre_gst": false,
            "unprocessed_payment_amount": 0,
            "unprocessed_payment_amount_formatted": "₹0.00"
        },
        {
            "ach_payment_initiated": false,
            "ach_payment_initiated_formatted": false,
            "invoice_id": "168648000000265001",
            "customer_id": "168648000000111622",
            "customer_name": "aruneshwar",
            "status": "draft",
            "status_formatted": "Draft",
            "invoice_number": "INV-000017",
            "reference_number": "",
            "date": "2023-11-08",
            "date_formatted": "08/11/2023",
            "due_date": "2023-11-08",
            "due_date_formatted": "08/11/2023",
            "due_days": "",
            "type_formatted": "Tax Invoice",
            "type": "invoice",
            "total": 300,
            "total_formatted": "₹300.00",
            "balance": 300,
            "balance_formatted": "₹300.00",
            "created_time": "2023-11-08T06:28:10+0530",
            "created_time_formatted": "08/11/2023 06:28 AM",
            "last_modified_time": "2023-11-08T06:28:12+0530",
            "is_viewed_by_client": false,
            "has_attachment": false,
            "client_viewed_time": "",
            "client_viewed_time_formatted": "",
            "is_emailed": false,
            "schedule_time": "",
            "schedule_time_formatted": "",
            "is_square_transaction": false,
            "is_pre_gst": false,
            "unprocessed_payment_amount": 0,
            "unprocessed_payment_amount_formatted": "₹0.00"
        },
        {
            "ach_payment_initiated": false,
            "ach_payment_initiated_formatted": false,
            "invoice_id": "168648000000273001",
            "customer_id": "168648000000111622",
            "customer_name": "aruneshwar",
            "status": "draft",
            "status_formatted": "Draft",
            "invoice_number": "INV-000018",
            "reference_number": "",
            "date": "2023-11-15",
            "date_formatted": "15/11/2023",
            "due_date": "2023-11-15",
            "due_date_formatted": "15/11/2023",
            "due_days": "",
            "type_formatted": "Tax Invoice",
            "type": "invoice",
            "total": 300,
            "total_formatted": "₹300.00",
            "balance": 300,
            "balance_formatted": "₹300.00",
            "created_time": "2023-11-15T06:09:25+0530",
            "created_time_formatted": "15/11/2023 06:09 AM",
            "last_modified_time": "2023-11-15T06:09:27+0530",
            "is_viewed_by_client": false,
            "has_attachment": false,
            "client_viewed_time": "",
            "client_viewed_time_formatted": "",
            "is_emailed": false,
            "schedule_time": "",
            "schedule_time_formatted": "",
            "is_square_transaction": false,
            "is_pre_gst": false,
            "unprocessed_payment_amount": 0,
            "unprocessed_payment_amount_formatted": "₹0.00"
        },
        {
            "ach_payment_initiated": false,
            "ach_payment_initiated_formatted": false,
            "invoice_id": "168648000000294001",
            "customer_id": "168648000000111622",
            "customer_name": "aruneshwar",
            "status": "draft",
            "status_formatted": "Draft",
            "invoice_number": "INV-000019",
            "reference_number": "",
            "date": "2023-11-22",
            "date_formatted": "22/11/2023",
            "due_date": "2023-11-22",
            "due_date_formatted": "22/11/2023",
            "due_days": "",
            "type_formatted": "Tax Invoice",
            "type": "invoice",
            "total": 300,
            "total_formatted": "₹300.00",
            "balance": 300,
            "balance_formatted": "₹300.00",
            "created_time": "2023-11-22T06:20:48+0530",
            "created_time_formatted": "22/11/2023 06:20 AM",
            "last_modified_time": "2023-11-22T06:20:49+0530",
            "is_viewed_by_client": false,
            "has_attachment": false,
            "client_viewed_time": "",
            "client_viewed_time_formatted": "",
            "is_emailed": false,
            "schedule_time": "",
            "schedule_time_formatted": "",
            "is_square_transaction": false,
            "is_pre_gst": false,
            "unprocessed_payment_amount": 0,
            "unprocessed_payment_amount_formatted": "₹0.00"
        },
        {
            "ach_payment_initiated": false,
            "ach_payment_initiated_formatted": false,
            "invoice_id": "168648000000321001",
            "customer_id": "168648000000111622",
            "customer_name": "aruneshwar",
            "status": "draft",
            "status_formatted": "Draft",
            "invoice_number": "INV-000020",
            "reference_number": "",
            "date": "2023-11-29",
            "date_formatted": "29/11/2023",
            "due_date": "2023-11-29",
            "due_date_formatted": "29/11/2023",
            "due_days": "",
            "type_formatted": "Tax Invoice",
            "type": "invoice",
            "total": 300,
            "total_formatted": "₹300.00",
            "balance": 300,
            "balance_formatted": "₹300.00",
            "created_time": "2023-11-29T06:10:33+0530",
            "created_time_formatted": "29/11/2023 06:10 AM",
            "last_modified_time": "2023-11-29T06:10:35+0530",
            "is_viewed_by_client": false,
            "has_attachment": false,
            "client_viewed_time": "",
            "client_viewed_time_formatted": "",
            "is_emailed": false,
            "schedule_time": "",
            "schedule_time_formatted": "",
            "is_square_transaction": false,
            "is_pre_gst": false,
            "unprocessed_payment_amount": 0,
            "unprocessed_payment_amount_formatted": "₹0.00"
        },
        {
            "ach_payment_initiated": false,
            "ach_payment_initiated_formatted": false,
            "invoice_id": "168648000000338001",
            "customer_id": "168648000000111622",
            "customer_name": "aruneshwar",
            "status": "draft",
            "status_formatted": "Draft",
            "invoice_number": "INV-000022",
            "reference_number": "",
            "date": "2023-12-06",
            "date_formatted": "06/12/2023",
            "due_date": "2023-12-06",
            "due_date_formatted": "06/12/2023",
            "due_days": "",
            "type_formatted": "Tax Invoice",
            "type": "invoice",
            "total": 300,
            "total_formatted": "₹300.00",
            "balance": 300,
            "balance_formatted": "₹300.00",
            "created_time": "2023-12-06T06:22:36+0530",
            "created_time_formatted": "06/12/2023 06:22 AM",
            "last_modified_time": "2023-12-06T06:22:38+0530",
            "is_viewed_by_client": false,
            "has_attachment": false,
            "client_viewed_time": "",
            "client_viewed_time_formatted": "",
            "is_emailed": false,
            "schedule_time": "",
            "schedule_time_formatted": "",
            "is_square_transaction": false,
            "is_pre_gst": false,
            "unprocessed_payment_amount": 0,
            "unprocessed_payment_amount_formatted": "₹0.00"
        },
        {
            "ach_payment_initiated": false,
            "ach_payment_initiated_formatted": false,
            "invoice_id": "168648000000343001",
            "customer_id": "168648000000111622",
            "customer_name": "aruneshwar",
            "status": "draft",
            "status_formatted": "Draft",
            "invoice_number": "INV-000023",
            "reference_number": "",
            "date": "2023-12-13",
            "date_formatted": "13/12/2023",
            "due_date": "2023-12-13",
            "due_date_formatted": "13/12/2023",
            "due_days": "",
            "type_formatted": "Tax Invoice",
            "type": "invoice",
            "total": 300,
            "total_formatted": "₹300.00",
            "balance": 300,
            "balance_formatted": "₹300.00",
            "created_time": "2023-12-13T06:06:51+0530",
            "created_time_formatted": "13/12/2023 06:06 AM",
            "last_modified_time": "2023-12-13T06:06:52+0530",
            "is_viewed_by_client": false,
            "has_attachment": false,
            "client_viewed_time": "",
            "client_viewed_time_formatted": "",
            "is_emailed": false,
            "schedule_time": "",
            "schedule_time_formatted": "",
            "is_square_transaction": false,
            "is_pre_gst": false,
            "unprocessed_payment_amount": 0,
            "unprocessed_payment_amount_formatted": "₹0.00"
        },
        {
            "ach_payment_initiated": false,
            "ach_payment_initiated_formatted": false,
            "invoice_id": "168648000000362001",
            "customer_id": "168648000000111622",
            "customer_name": "aruneshwar",
            "status": "draft",
            "status_formatted": "Draft",
            "invoice_number": "INV-000024",
            "reference_number": "",
            "date": "2023-12-20",
            "date_formatted": "20/12/2023",
            "due_date": "2023-12-20",
            "due_date_formatted": "20/12/2023",
            "due_days": "",
            "type_formatted": "Tax Invoice",
            "type": "invoice",
            "total": 300,
            "total_formatted": "₹300.00",
            "balance": 300,
            "balance_formatted": "₹300.00",
            "created_time": "2023-12-20T06:21:40+0530",
            "created_time_formatted": "20/12/2023 06:21 AM",
            "last_modified_time": "2023-12-20T06:21:42+0530",
            "is_viewed_by_client": false,
            "has_attachment": false,
            "client_viewed_time": "",
            "client_viewed_time_formatted": "",
            "is_emailed": false,
            "schedule_time": "",
            "schedule_time_formatted": "",
            "is_square_transaction": false,
            "is_pre_gst": false,
            "unprocessed_payment_amount": 0,
            "unprocessed_payment_amount_formatted": "₹0.00"
        },
        {
            "ach_payment_initiated": false,
            "ach_payment_initiated_formatted": false,
            "invoice_id": "168648000000376001",
            "customer_id": "168648000000111622",
            "customer_name": "aruneshwar",
            "status": "draft",
            "status_formatted": "Draft",
            "invoice_number": "INV-000026",
            "reference_number": "",
            "date": "2023-12-27",
            "date_formatted": "27/12/2023",
            "due_date": "2023-12-27",
            "due_date_formatted": "27/12/2023",
            "due_days": "",
            "type_formatted": "Tax Invoice",
            "type": "invoice",
            "total": 300,
            "total_formatted": "₹300.00",
            "balance": 300,
            "balance_formatted": "₹300.00",
            "created_time": "2023-12-27T06:02:50+0530",
            "created_time_formatted": "27/12/2023 06:02 AM",
            "last_modified_time": "2023-12-27T06:02:51+0530",
            "is_viewed_by_client": false,
            "has_attachment": false,
            "client_viewed_time": "",
            "client_viewed_time_formatted": "",
            "is_emailed": false,
            "schedule_time": "",
            "schedule_time_formatted": "",
            "is_square_transaction": false,
            "is_pre_gst": false,
            "unprocessed_payment_amount": 0,
            "unprocessed_payment_amount_formatted": "₹0.00"
        },
        {
            "ach_payment_initiated": false,
            "ach_payment_initiated_formatted": false,
            "invoice_id": "168648000000395001",
            "customer_id": "168648000000111622",
            "customer_name": "aruneshwar",
            "status": "draft",
            "status_formatted": "Draft",
            "invoice_number": "INV-000029",
            "reference_number": "",
            "date": "2024-01-03",
            "date_formatted": "03/01/2024",
            "due_date": "2024-01-03",
            "due_date_formatted": "03/01/2024",
            "due_days": "",
            "type_formatted": "Tax Invoice",
            "type": "invoice",
            "total": 300,
            "total_formatted": "₹300.00",
            "balance": 300,
            "balance_formatted": "₹300.00",
            "created_time": "2024-01-03T06:25:15+0530",
            "created_time_formatted": "03/01/2024 06:25 AM",
            "last_modified_time": "2024-01-03T06:25:16+0530",
            "is_viewed_by_client": false,
            "has_attachment": false,
            "client_viewed_time": "",
            "client_viewed_time_formatted": "",
            "is_emailed": false,
            "schedule_time": "",
            "schedule_time_formatted": "",
            "is_square_transaction": false,
            "is_pre_gst": false,
            "unprocessed_payment_amount": 0,
            "unprocessed_payment_amount_formatted": "₹0.00"
        },
        {
            "ach_payment_initiated": false,
            "ach_payment_initiated_formatted": false,
            "invoice_id": "168648000000409001",
            "customer_id": "168648000000111622",
            "customer_name": "aruneshwar",
            "status": "draft",
            "status_formatted": "Draft",
            "invoice_number": "INV-000030",
            "reference_number": "",
            "date": "2024-01-10",
            "date_formatted": "10/01/2024",
            "due_date": "2024-01-10",
            "due_date_formatted": "10/01/2024",
            "due_days": "",
            "type_formatted": "Tax Invoice",
            "type": "invoice",
            "total": 300,
            "total_formatted": "₹300.00",
            "balance": 300,
            "balance_formatted": "₹300.00",
            "created_time": "2024-01-10T06:13:39+0530",
            "created_time_formatted": "10/01/2024 06:13 AM",
            "last_modified_time": "2024-01-10T06:13:40+0530",
            "is_viewed_by_client": false,
            "has_attachment": false,
            "client_viewed_time": "",
            "client_viewed_time_formatted": "",
            "is_emailed": false,
            "schedule_time": "",
            "schedule_time_formatted": "",
            "is_square_transaction": false,
            "is_pre_gst": false,
            "unprocessed_payment_amount": 0,
            "unprocessed_payment_amount_formatted": "₹0.00"
        },
        {
            "ach_payment_initiated": false,
            "ach_payment_initiated_formatted": false,
            "invoice_id": "168648000000411071",
            "customer_id": "168648000000370001",
            "customer_name": "aruneshwar+1",
            "status": "draft",
            "status_formatted": "Draft",
            "invoice_number": "INV-000033",
            "reference_number": "",
            "date": "2024-01-10",
            "date_formatted": "10/01/2024",
            "due_date": "2024-01-10",
            "due_date_formatted": "10/01/2024",
            "due_days": "",
            "type_formatted": "Tax Invoice",
            "type": "invoice",
            "total": 300,
            "total_formatted": "₹300.00",
            "balance": 300,
            "balance_formatted": "₹300.00",
            "created_time": "2024-01-10T15:40:23+0530",
            "created_time_formatted": "10/01/2024 03:40 PM",
            "last_modified_time": "2024-01-10T15:40:23+0530",
            "is_viewed_by_client": false,
            "has_attachment": false,
            "client_viewed_time": "",
            "client_viewed_time_formatted": "",
            "is_emailed": false,
            "schedule_time": "",
            "schedule_time_formatted": "",
            "is_square_transaction": false,
            "is_pre_gst": false,
            "unprocessed_payment_amount": 0,
            "unprocessed_payment_amount_formatted": "₹0.00"
        },
        {
            "ach_payment_initiated": false,
            "ach_payment_initiated_formatted": false,
            "invoice_id": "168648000000417001",
            "customer_id": "168648000000111622",
            "customer_name": "aruneshwar",
            "status": "draft",
            "status_formatted": "Draft",
            "invoice_number": "INV-000034",
            "reference_number": "",
            "date": "2024-01-17",
            "date_formatted": "17/01/2024",
            "due_date": "2024-01-17",
            "due_date_formatted": "17/01/2024",
            "due_days": "",
            "type_formatted": "Tax Invoice",
            "type": "invoice",
            "total": 300,
            "total_formatted": "₹300.00",
            "balance": 300,
            "balance_formatted": "₹300.00",
            "created_time": "2024-01-17T06:26:39+0530",
            "created_time_formatted": "17/01/2024 06:26 AM",
            "last_modified_time": "2024-01-17T06:26:41+0530",
            "is_viewed_by_client": false,
            "has_attachment": false,
            "client_viewed_time": "",
            "client_viewed_time_formatted": "",
            "is_emailed": false,
            "schedule_time": "",
            "schedule_time_formatted": "",
            "is_square_transaction": false,
            "is_pre_gst": false,
            "unprocessed_payment_amount": 0,
            "unprocessed_payment_amount_formatted": "₹0.00"
        },
        {
            "ach_payment_initiated": false,
            "ach_payment_initiated_formatted": false,
            "invoice_id": "168648000000429001",
            "customer_id": "168648000000111622",
            "customer_name": "aruneshwar",
            "status": "draft",
            "status_formatted": "Draft",
            "invoice_number": "INV-000035",
            "reference_number": "",
            "date": "2024-01-24",
            "date_formatted": "24/01/2024",
            "due_date": "2024-01-24",
            "due_date_formatted": "24/01/2024",
            "due_days": "",
            "type_formatted": "Tax Invoice",
            "type": "invoice",
            "total": 300,
            "total_formatted": "₹300.00",
            "balance": 300,
            "balance_formatted": "₹300.00",
            "created_time": "2024-01-24T06:08:47+0530",
            "created_time_formatted": "24/01/2024 06:08 AM",
            "last_modified_time": "2024-01-24T06:08:48+0530",
            "is_viewed_by_client": false,
            "has_attachment": false,
            "client_viewed_time": "",
            "client_viewed_time_formatted": "",
            "is_emailed": false,
            "schedule_time": "",
            "schedule_time_formatted": "",
            "is_square_transaction": false,
            "is_pre_gst": false,
            "unprocessed_payment_amount": 0,
            "unprocessed_payment_amount_formatted": "₹0.00"
        },
        {
            "ach_payment_initiated": false,
            "ach_payment_initiated_formatted": false,
            "invoice_id": "168648000000438001",
            "customer_id": "168648000000111622",
            "customer_name": "aruneshwar",
            "status": "draft",
            "status_formatted": "Draft",
            "invoice_number": "INV-000037",
            "reference_number": "",
            "date": "2024-01-31",
            "date_formatted": "31/01/2024",
            "due_date": "2024-01-31",
            "due_date_formatted": "31/01/2024",
            "due_days": "",
            "type_formatted": "Tax Invoice",
            "type": "invoice",
            "total": 300,
            "total_formatted": "₹300.00",
            "balance": 300,
            "balance_formatted": "₹300.00",
            "created_time": "2024-01-31T06:17:27+0530",
            "created_time_formatted": "31/01/2024 06:17 AM",
            "last_modified_time": "2024-01-31T06:17:29+0530",
            "is_viewed_by_client": false,
            "has_attachment": false,
            "client_viewed_time": "",
            "client_viewed_time_formatted": "",
            "is_emailed": false,
            "schedule_time": "",
            "schedule_time_formatted": "",
            "is_square_transaction": false,
            "is_pre_gst": false,
            "unprocessed_payment_amount": 0,
            "unprocessed_payment_amount_formatted": "₹0.00"
        },
        {
            "ach_payment_initiated": false,
            "ach_payment_initiated_formatted": false,
            "invoice_id": "168648000000452001",
            "customer_id": "168648000000111622",
            "customer_name": "aruneshwar",
            "status": "draft",
            "status_formatted": "Draft",
            "invoice_number": "INV-000038",
            "reference_number": "",
            "date": "2024-02-07",
            "date_formatted": "07/02/2024",
            "due_date": "2024-02-07",
            "due_date_formatted": "07/02/2024",
            "due_days": "",
            "type_formatted": "Tax Invoice",
            "type": "invoice",
            "total": 300,
            "total_formatted": "₹300.00",
            "balance": 300,
            "balance_formatted": "₹300.00",
            "created_time": "2024-02-07T06:02:12+0530",
            "created_time_formatted": "07/02/2024 06:02 AM",
            "last_modified_time": "2024-02-07T06:02:13+0530",
            "is_viewed_by_client": false,
            "has_attachment": false,
            "client_viewed_time": "",
            "client_viewed_time_formatted": "",
            "is_emailed": false,
            "schedule_time": "",
            "schedule_time_formatted": "",
            "is_square_transaction": false,
            "is_pre_gst": false,
            "unprocessed_payment_amount": 0,
            "unprocessed_payment_amount_formatted": "₹0.00"
        },
        {
            "ach_payment_initiated": false,
            "ach_payment_initiated_formatted": false,
            "invoice_id": "168648000000465001",
            "customer_id": "168648000000111622",
            "customer_name": "aruneshwar",
            "status": "draft",
            "status_formatted": "Draft",
            "invoice_number": "INV-000039",
            "reference_number": "",
            "date": "2024-02-14",
            "date_formatted": "14/02/2024",
            "due_date": "2024-02-14",
            "due_date_formatted": "14/02/2024",
            "due_days": "",
            "type_formatted": "Tax Invoice",
            "type": "invoice",
            "total": 300,
            "total_formatted": "₹300.00",
            "balance": 300,
            "balance_formatted": "₹300.00",
            "created_time": "2024-02-14T06:15:08+0530",
            "created_time_formatted": "14/02/2024 06:15 AM",
            "last_modified_time": "2024-02-14T06:15:09+0530",
            "is_viewed_by_client": false,
            "has_attachment": false,
            "client_viewed_time": "",
            "client_viewed_time_formatted": "",
            "is_emailed": false,
            "schedule_time": "",
            "schedule_time_formatted": "",
            "is_square_transaction": false,
            "is_pre_gst": false,
            "unprocessed_payment_amount": 0,
            "unprocessed_payment_amount_formatted": "₹0.00"
        },
        {
            "ach_payment_initiated": false,
            "ach_payment_initiated_formatted": false,
            "invoice_id": "168648000000479001",
            "customer_id": "168648000000111622",
            "customer_name": "aruneshwar",
            "status": "draft",
            "status_formatted": "Draft",
            "invoice_number": "INV-000040",
            "reference_number": "",
            "date": "2024-02-21",
            "date_formatted": "21/02/2024",
            "due_date": "2024-02-21",
            "due_date_formatted": "21/02/2024",
            "due_days": "",
            "type_formatted": "Tax Invoice",
            "type": "invoice",
            "total": 300,
            "total_formatted": "₹300.00",
            "balance": 300,
            "balance_formatted": "₹300.00",
            "created_time": "2024-02-21T06:29:12+0530",
            "created_time_formatted": "21/02/2024 06:29 AM",
            "last_modified_time": "2024-02-21T06:29:13+0530",
            "is_viewed_by_client": false,
            "has_attachment": false,
            "client_viewed_time": "",
            "client_viewed_time_formatted": "",
            "is_emailed": false,
            "schedule_time": "",
            "schedule_time_formatted": "",
            "is_square_transaction": false,
            "is_pre_gst": false,
            "unprocessed_payment_amount": 0,
            "unprocessed_payment_amount_formatted": "₹0.00"
        },
        {
            "ach_payment_initiated": false,
            "ach_payment_initiated_formatted": false,
            "invoice_id": "168648000000488001",
            "customer_id": "168648000000111622",
            "customer_name": "aruneshwar",
            "status": "draft",
            "status_formatted": "Draft",
            "invoice_number": "INV-000041",
            "reference_number": "",
            "date": "2024-03-06",
            "date_formatted": "06/03/2024",
            "due_date": "2024-03-06",
            "due_date_formatted": "06/03/2024",
            "due_days": "",
            "type_formatted": "Tax Invoice",
            "type": "invoice",
            "total": 300,
            "total_formatted": "₹300.00",
            "balance": 300,
            "balance_formatted": "₹300.00",
            "created_time": "2024-02-23T10:46:06+0530",
            "created_time_formatted": "23/02/2024 10:46 AM",
            "last_modified_time": "2024-02-23T10:46:06+0530",
            "is_viewed_by_client": false,
            "has_attachment": false,
            "client_viewed_time": "",
            "client_viewed_time_formatted": "",
            "is_emailed": false,
            "schedule_time": "",
            "schedule_time_formatted": "",
            "is_square_transaction": false,
            "is_pre_gst": false,
            "unprocessed_payment_amount": 0,
            "unprocessed_payment_amount_formatted": "₹0.00"
        },
        {
            "ach_payment_initiated": false,
            "ach_payment_initiated_formatted": false,
            "invoice_id": "168648000000488095",
            "customer_id": "168648000000111622",
            "customer_name": "aruneshwar",
            "status": "draft",
            "status_formatted": "Draft",
            "invoice_number": "INV-000042",
            "reference_number": "",
            "date": "2024-02-23",
            "date_formatted": "23/02/2024",
            "due_date": "2024-02-23",
            "due_date_formatted": "23/02/2024",
            "due_days": "",
            "type_formatted": "Tax Invoice",
            "type": "invoice",
            "total": 300,
            "total_formatted": "₹300.00",
            "balance": 300,
            "balance_formatted": "₹300.00",
            "created_time": "2024-02-23T11:21:31+0530",
            "created_time_formatted": "23/02/2024 11:21 AM",
            "last_modified_time": "2024-02-23T11:21:31+0530",
            "is_viewed_by_client": false,
            "has_attachment": false,
            "client_viewed_time": "",
            "client_viewed_time_formatted": "",
            "is_emailed": false,
            "schedule_time": "",
            "schedule_time_formatted": "",
            "is_square_transaction": false,
            "is_pre_gst": false,
            "unprocessed_payment_amount": 0,
            "unprocessed_payment_amount_formatted": "₹0.00"
        },
        {
            "ach_payment_initiated": false,
            "ach_payment_initiated_formatted": false,
            "invoice_id": "168648000000496001",
            "customer_id": "168648000000111622",
            "customer_name": "aruneshwar",
            "status": "draft",
            "status_formatted": "Draft",
            "invoice_number": "INV-000043",
            "reference_number": "",
            "date": "2024-02-28",
            "date_formatted": "28/02/2024",
            "due_date": "2024-02-28",
            "due_date_formatted": "28/02/2024",
            "due_days": "",
            "type_formatted": "Tax Invoice",
            "type": "invoice",
            "total": 300,
            "total_formatted": "₹300.00",
            "balance": 300,
            "balance_formatted": "₹300.00",
            "created_time": "2024-02-28T06:16:48+0530",
            "created_time_formatted": "28/02/2024 06:16 AM",
            "last_modified_time": "2024-02-28T06:16:48+0530",
            "is_viewed_by_client": false,
            "has_attachment": false,
            "client_viewed_time": "",
            "client_viewed_time_formatted": "",
            "is_emailed": false,
            "schedule_time": "",
            "schedule_time_formatted": "",
            "is_square_transaction": false,
            "is_pre_gst": false,
            "unprocessed_payment_amount": 0,
            "unprocessed_payment_amount_formatted": "₹0.00"
        },
        {
            "ach_payment_initiated": false,
            "ach_payment_initiated_formatted": false,
            "invoice_id": "168648000000510009",
            "customer_id": "168648000000111622",
            "customer_name": "aruneshwar",
            "status": "draft",
            "status_formatted": "Draft",
            "invoice_number": "INV-000045",
            "reference_number": "",
            "date": "2024-03-06",
            "date_formatted": "06/03/2024",
            "due_date": "2024-03-06",
            "due_date_formatted": "06/03/2024",
            "due_days": "",
            "type_formatted": "Tax Invoice",
            "type": "invoice",
            "total": 300,
            "total_formatted": "₹300.00",
            "balance": 300,
            "balance_formatted": "₹300.00",
            "created_time": "2024-03-06T06:07:27+0530",
            "created_time_formatted": "06/03/2024 06:07 AM",
            "last_modified_time": "2024-03-06T06:07:28+0530",
            "is_viewed_by_client": false,
            "has_attachment": false,
            "client_viewed_time": "",
            "client_viewed_time_formatted": "",
            "is_emailed": false,
            "schedule_time": "",
            "schedule_time_formatted": "",
            "is_square_transaction": false,
            "is_pre_gst": false,
            "unprocessed_payment_amount": 0,
            "unprocessed_payment_amount_formatted": "₹0.00"
        },
        {
            "ach_payment_initiated": false,
            "ach_payment_initiated_formatted": false,
            "invoice_id": "168648000000522003",
            "customer_id": "168648000000111622",
            "customer_name": "aruneshwar",
            "status": "approved",
            "status_formatted": "Approved",
            "invoice_number": "INV-000046",
            "reference_number": "",
            "date": "2024-03-13",
            "date_formatted": "13/03/2024",
            "due_date": "2024-03-13",
            "due_date_formatted": "13/03/2024",
            "due_days": "",
            "type_formatted": "Tax Invoice",
            "type": "invoice",
            "total": 300,
            "total_formatted": "₹300.00",
            "balance": 300,
            "balance_formatted": "₹300.00",
            "created_time": "2024-03-13T06:22:01+0530",
            "created_time_formatted": "13/03/2024 06:22 AM",
            "last_modified_time": "2024-07-30T15:15:25+0530",
            "is_viewed_by_client": false,
            "has_attachment": false,
            "client_viewed_time": "",
            "client_viewed_time_formatted": "",
            "is_emailed": false,
            "schedule_time": "",
            "schedule_time_formatted": "",
            "is_square_transaction": false,
            "is_pre_gst": false,
            "unprocessed_payment_amount": 0,
            "unprocessed_payment_amount_formatted": "₹0.00"
        },
        {
            "ach_payment_initiated": false,
            "ach_payment_initiated_formatted": false,
            "invoice_id": "168648000000537003",
            "customer_id": "168648000000111622",
            "customer_name": "aruneshwar",
            "status": "draft",
            "status_formatted": "Draft",
            "invoice_number": "INV-000047",
            "reference_number": "",
            "date": "2024-03-20",
            "date_formatted": "20/03/2024",
            "due_date": "2024-03-20",
            "due_date_formatted": "20/03/2024",
            "due_days": "",
            "type_formatted": "Tax Invoice",
            "type": "invoice",
            "total": 300,
            "total_formatted": "₹300.00",
            "balance": 300,
            "balance_formatted": "₹300.00",
            "created_time": "2024-03-20T06:10:51+0530",
            "created_time_formatted": "20/03/2024 06:10 AM",
            "last_modified_time": "2024-03-20T06:10:53+0530",
            "is_viewed_by_client": false,
            "has_attachment": false,
            "client_viewed_time": "",
            "client_viewed_time_formatted": "",
            "is_emailed": false,
            "schedule_time": "",
            "schedule_time_formatted": "",
            "is_square_transaction": false,
            "is_pre_gst": false,
            "unprocessed_payment_amount": 0,
            "unprocessed_payment_amount_formatted": "₹0.00"
        },
        {
            "ach_payment_initiated": false,
            "ach_payment_initiated_formatted": false,
            "invoice_id": "168648000000555003",
            "customer_id": "168648000000111622",
            "customer_name": "aruneshwar",
            "status": "draft",
            "status_formatted": "Draft",
            "invoice_number": "INV-000048",
            "reference_number": "",
            "date": "2024-03-27",
            "date_formatted": "27/03/2024",
            "due_date": "2024-03-27",
            "due_date_formatted": "27/03/2024",
            "due_days": "",
            "type_formatted": "Tax Invoice",
            "type": "invoice",
            "total": 300,
            "total_formatted": "₹300.00",
            "balance": 300,
            "balance_formatted": "₹300.00",
            "created_time": "2024-03-27T06:24:34+0530",
            "created_time_formatted": "27/03/2024 06:24 AM",
            "last_modified_time": "2024-03-27T06:24:35+0530",
            "is_viewed_by_client": false,
            "has_attachment": false,
            "client_viewed_time": "",
            "client_viewed_time_formatted": "",
            "is_emailed": false,
            "schedule_time": "",
            "schedule_time_formatted": "",
            "is_square_transaction": false,
            "is_pre_gst": false,
            "unprocessed_payment_amount": 0,
            "unprocessed_payment_amount_formatted": "₹0.00"
        },
        {
            "ach_payment_initiated": false,
            "ach_payment_initiated_formatted": false,
            "invoice_id": "168648000000567003",
            "customer_id": "168648000000111622",
            "customer_name": "aruneshwar",
            "status": "draft",
            "status_formatted": "Draft",
            "invoice_number": "INV-000050",
            "reference_number": "",
            "date": "2024-04-03",
            "date_formatted": "03/04/2024",
            "due_date": "2024-04-03",
            "due_date_formatted": "03/04/2024",
            "due_days": "",
            "type_formatted": "Tax Invoice",
            "type": "invoice",
            "total": 300,
            "total_formatted": "₹300.00",
            "balance": 300,
            "balance_formatted": "₹300.00",
            "created_time": "2024-04-03T06:04:45+0530",
            "created_time_formatted": "03/04/2024 06:04 AM",
            "last_modified_time": "2024-04-03T06:04:46+0530",
            "is_viewed_by_client": false,
            "has_attachment": false,
            "client_viewed_time": "",
            "client_viewed_time_formatted": "",
            "is_emailed": false,
            "schedule_time": "",
            "schedule_time_formatted": "",
            "is_square_transaction": false,
            "is_pre_gst": false,
            "unprocessed_payment_amount": 0,
            "unprocessed_payment_amount_formatted": "₹0.00"
        },
        {
            "ach_payment_initiated": false,
            "ach_payment_initiated_formatted": false,
            "invoice_id": "168648000000577003",
            "customer_id": "168648000000111622",
            "customer_name": "aruneshwar",
            "status": "draft",
            "status_formatted": "Draft",
            "invoice_number": "INV-000051",
            "reference_number": "",
            "date": "2024-04-10",
            "date_formatted": "10/04/2024",
            "due_date": "2024-04-10",
            "due_date_formatted": "10/04/2024",
            "due_days": "",
            "type_formatted": "Tax Invoice",
            "type": "invoice",
            "total": 300,
            "total_formatted": "₹300.00",
            "balance": 300,
            "balance_formatted": "₹300.00",
            "created_time": "2024-04-10T06:17:55+0530",
            "created_time_formatted": "10/04/2024 06:17 AM",
            "last_modified_time": "2024-04-10T06:17:56+0530",
            "is_viewed_by_client": false,
            "has_attachment": false,
            "client_viewed_time": "",
            "client_viewed_time_formatted": "",
            "is_emailed": false,
            "schedule_time": "",
            "schedule_time_formatted": "",
            "is_square_transaction": false,
            "is_pre_gst": false,
            "unprocessed_payment_amount": 0,
            "unprocessed_payment_amount_formatted": "₹0.00"
        },
        {
            "ach_payment_initiated": false,
            "ach_payment_initiated_formatted": false,
            "invoice_id": "168648000000589003",
            "customer_id": "168648000000111622",
            "customer_name": "aruneshwar",
            "status": "draft",
            "status_formatted": "Draft",
            "invoice_number": "INV-000052",
            "reference_number": "",
            "date": "2024-04-17",
            "date_formatted": "17/04/2024",
            "due_date": "2024-04-17",
            "due_date_formatted": "17/04/2024",
            "due_days": "",
            "type_formatted": "Tax Invoice",
            "type": "invoice",
            "total": 300,
            "total_formatted": "₹300.00",
            "balance": 300,
            "balance_formatted": "₹300.00",
            "created_time": "2024-04-17T06:29:09+0530",
            "created_time_formatted": "17/04/2024 06:29 AM",
            "last_modified_time": "2024-04-17T06:29:11+0530",
            "is_viewed_by_client": false,
            "has_attachment": false,
            "client_viewed_time": "",
            "client_viewed_time_formatted": "",
            "is_emailed": false,
            "schedule_time": "",
            "schedule_time_formatted": "",
            "is_square_transaction": false,
            "is_pre_gst": false,
            "unprocessed_payment_amount": 0,
            "unprocessed_payment_amount_formatted": "₹0.00"
        },
        {
            "ach_payment_initiated": false,
            "ach_payment_initiated_formatted": false,
            "invoice_id": "168648000000604003",
            "customer_id": "168648000000111622",
            "customer_name": "aruneshwar",
            "status": "draft",
            "status_formatted": "Draft",
            "invoice_number": "INV-000053",
            "reference_number": "",
            "date": "2024-04-24",
            "date_formatted": "24/04/2024",
            "due_date": "2024-04-24",
            "due_date_formatted": "24/04/2024",
            "due_days": "",
            "type_formatted": "Tax Invoice",
            "type": "invoice",
            "total": 300,
            "total_formatted": "₹300.00",
            "balance": 300,
            "balance_formatted": "₹300.00",
            "created_time": "2024-04-24T06:23:53+0530",
            "created_time_formatted": "24/04/2024 06:23 AM",
            "last_modified_time": "2024-04-24T06:23:54+0530",
            "is_viewed_by_client": false,
            "has_attachment": false,
            "client_viewed_time": "",
            "client_viewed_time_formatted": "",
            "is_emailed": false,
            "schedule_time": "",
            "schedule_time_formatted": "",
            "is_square_transaction": false,
            "is_pre_gst": false,
            "unprocessed_payment_amount": 0,
            "unprocessed_payment_amount_formatted": "₹0.00"
        },
        {
            "ach_payment_initiated": false,
            "ach_payment_initiated_formatted": false,
            "invoice_id": "168648000000623003",
            "customer_id": "168648000000111622",
            "customer_name": "aruneshwar",
            "status": "draft",
            "status_formatted": "Draft",
            "invoice_number": "INV-000055",
            "reference_number": "",
            "date": "2024-05-01",
            "date_formatted": "01/05/2024",
            "due_date": "2024-05-01",
            "due_date_formatted": "01/05/2024",
            "due_days": "",
            "type_formatted": "Tax Invoice",
            "type": "invoice",
            "total": 300,
            "total_formatted": "₹300.00",
            "balance": 300,
            "balance_formatted": "₹300.00",
            "created_time": "2024-05-01T06:21:10+0530",
            "created_time_formatted": "01/05/2024 06:21 AM",
            "last_modified_time": "2024-05-01T06:21:11+0530",
            "is_viewed_by_client": false,
            "has_attachment": false,
            "client_viewed_time": "",
            "client_viewed_time_formatted": "",
            "is_emailed": false,
            "schedule_time": "",
            "schedule_time_formatted": "",
            "is_square_transaction": false,
            "is_pre_gst": false,
            "unprocessed_payment_amount": 0,
            "unprocessed_payment_amount_formatted": "₹0.00"
        },
        {
            "ach_payment_initiated": false,
            "ach_payment_initiated_formatted": false,
            "invoice_id": "168648000000637003",
            "customer_id": "168648000000111622",
            "customer_name": "aruneshwar",
            "status": "draft",
            "status_formatted": "Draft",
            "invoice_number": "INV-000056",
            "reference_number": "",
            "date": "2024-05-08",
            "date_formatted": "08/05/2024",
            "due_date": "2024-05-08",
            "due_date_formatted": "08/05/2024",
            "due_days": "",
            "type_formatted": "Tax Invoice",
            "type": "invoice",
            "total": 300,
            "total_formatted": "₹300.00",
            "balance": 300,
            "balance_formatted": "₹300.00",
            "created_time": "2024-05-08T06:12:49+0530",
            "created_time_formatted": "08/05/2024 06:12 AM",
            "last_modified_time": "2024-05-08T06:12:50+0530",
            "is_viewed_by_client": false,
            "has_attachment": false,
            "client_viewed_time": "",
            "client_viewed_time_formatted": "",
            "is_emailed": false,
            "schedule_time": "",
            "schedule_time_formatted": "",
            "is_square_transaction": false,
            "is_pre_gst": false,
            "unprocessed_payment_amount": 0,
            "unprocessed_payment_amount_formatted": "₹0.00"
        },
        {
            "ach_payment_initiated": false,
            "ach_payment_initiated_formatted": false,
            "invoice_id": "168648000000651001",
            "customer_id": "168648000000111622",
            "customer_name": "aruneshwar",
            "status": "draft",
            "status_formatted": "Draft",
            "invoice_number": "INV-000057",
            "reference_number": "",
            "date": "2024-05-15",
            "date_formatted": "15/05/2024",
            "due_date": "2024-05-15",
            "due_date_formatted": "15/05/2024",
            "due_days": "",
            "type_formatted": "Tax Invoice",
            "type": "invoice",
            "total": 300,
            "total_formatted": "₹300.00",
            "balance": 300,
            "balance_formatted": "₹300.00",
            "created_time": "2024-05-15T06:27:05+0530",
            "created_time_formatted": "15/05/2024 06:27 AM",
            "last_modified_time": "2024-05-15T06:27:06+0530",
            "is_viewed_by_client": false,
            "has_attachment": false,
            "client_viewed_time": "",
            "client_viewed_time_formatted": "",
            "is_emailed": false,
            "schedule_time": "",
            "schedule_time_formatted": "",
            "is_square_transaction": false,
            "is_pre_gst": false,
            "unprocessed_payment_amount": 0,
            "unprocessed_payment_amount_formatted": "₹0.00"
        },
        {
            "ach_payment_initiated": false,
            "ach_payment_initiated_formatted": false,
            "invoice_id": "168648000000667001",
            "customer_id": "168648000000111622",
            "customer_name": "aruneshwar",
            "status": "draft",
            "status_formatted": "Draft",
            "invoice_number": "INV-000058",
            "reference_number": "",
            "date": "2024-05-22",
            "date_formatted": "22/05/2024",
            "due_date": "2024-05-22",
            "due_date_formatted": "22/05/2024",
            "due_days": "",
            "type_formatted": "Tax Invoice",
            "type": "invoice",
            "total": 300,
            "total_formatted": "₹300.00",
            "balance": 300,
            "balance_formatted": "₹300.00",
            "created_time": "2024-05-22T06:16:53+0530",
            "created_time_formatted": "22/05/2024 06:16 AM",
            "last_modified_time": "2024-05-27T12:31:25+0530",
            "is_viewed_by_client": false,
            "has_attachment": false,
            "client_viewed_time": "",
            "client_viewed_time_formatted": "",
            "is_emailed": false,
            "schedule_time": "",
            "schedule_time_formatted": "",
            "is_square_transaction": false,
            "is_pre_gst": false,
            "unprocessed_payment_amount": 0,
            "unprocessed_payment_amount_formatted": "₹0.00"
        },
        {
            "ach_payment_initiated": false,
            "ach_payment_initiated_formatted": false,
            "invoice_id": "168648000000687001",
            "customer_id": "168648000000111622",
            "customer_name": "aruneshwar",
            "status": "draft",
            "status_formatted": "Draft",
            "invoice_number": "INV-000059",
            "reference_number": "",
            "date": "2024-05-29",
            "date_formatted": "29/05/2024",
            "due_date": "2024-05-29",
            "due_date_formatted": "29/05/2024",
            "due_days": "",
            "type_formatted": "Tax Invoice",
            "type": "invoice",
            "total": 300,
            "total_formatted": "₹300.00",
            "balance": 300,
            "balance_formatted": "₹300.00",
            "created_time": "2024-05-29T06:13:07+0530",
            "created_time_formatted": "29/05/2024 06:13 AM",
            "last_modified_time": "2024-05-29T06:13:08+0530",
            "is_viewed_by_client": false,
            "has_attachment": false,
            "client_viewed_time": "",
            "client_viewed_time_formatted": "",
            "is_emailed": false,
            "schedule_time": "",
            "schedule_time_formatted": "",
            "is_square_transaction": false,
            "is_pre_gst": false,
            "unprocessed_payment_amount": 0,
            "unprocessed_payment_amount_formatted": "₹0.00"
        },
        {
            "ach_payment_initiated": false,
            "ach_payment_initiated_formatted": false,
            "invoice_id": "168648000000705007",
            "customer_id": "168648000000111622",
            "customer_name": "aruneshwar",
            "status": "draft",
            "status_formatted": "Draft",
            "invoice_number": "INV-000061",
            "reference_number": "",
            "date": "2024-06-05",
            "date_formatted": "05/06/2024",
            "due_date": "2024-06-05",
            "due_date_formatted": "05/06/2024",
            "due_days": "",
            "type_formatted": "Tax Invoice",
            "type": "invoice",
            "total": 300,
            "total_formatted": "₹300.00",
            "balance": 300,
            "balance_formatted": "₹300.00",
            "created_time": "2024-06-05T06:29:36+0530",
            "created_time_formatted": "05/06/2024 06:29 AM",
            "last_modified_time": "2024-06-05T06:29:37+0530",
            "is_viewed_by_client": false,
            "has_attachment": false,
            "client_viewed_time": "",
            "client_viewed_time_formatted": "",
            "is_emailed": false,
            "schedule_time": "",
            "schedule_time_formatted": "",
            "is_square_transaction": false,
            "is_pre_gst": false,
            "unprocessed_payment_amount": 0,
            "unprocessed_payment_amount_formatted": "₹0.00"
        },
        {
            "ach_payment_initiated": false,
            "ach_payment_initiated_formatted": false,
            "invoice_id": "168648000000719001",
            "customer_id": "168648000000111622",
            "customer_name": "aruneshwar",
            "status": "draft",
            "status_formatted": "Draft",
            "invoice_number": "INV-000062",
            "reference_number": "",
            "date": "2024-06-12",
            "date_formatted": "12/06/2024",
            "due_date": "2024-06-12",
            "due_date_formatted": "12/06/2024",
            "due_days": "",
            "type_formatted": "Tax Invoice",
            "type": "invoice",
            "total": 300,
            "total_formatted": "₹300.00",
            "balance": 300,
            "balance_formatted": "₹300.00",
            "created_time": "2024-06-12T06:12:41+0530",
            "created_time_formatted": "12/06/2024 06:12 AM",
            "last_modified_time": "2024-06-12T06:12:42+0530",
            "is_viewed_by_client": false,
            "has_attachment": false,
            "client_viewed_time": "",
            "client_viewed_time_formatted": "",
            "is_emailed": false,
            "schedule_time": "",
            "schedule_time_formatted": "",
            "is_square_transaction": false,
            "is_pre_gst": false,
            "unprocessed_payment_amount": 0,
            "unprocessed_payment_amount_formatted": "₹0.00"
        },
        {
            "ach_payment_initiated": false,
            "ach_payment_initiated_formatted": false,
            "invoice_id": "168648000000731001",
            "customer_id": "168648000000111622",
            "customer_name": "aruneshwar",
            "status": "draft",
            "status_formatted": "Draft",
            "invoice_number": "INV-000064",
            "reference_number": "",
            "date": "2024-06-20",
            "date_formatted": "20/06/2024",
            "due_date": "2024-06-20",
            "due_date_formatted": "20/06/2024",
            "due_days": "",
            "type_formatted": "Tax Invoice",
            "type": "invoice",
            "total": 300,
            "total_formatted": "₹300.00",
            "balance": 300,
            "balance_formatted": "₹300.00",
            "created_time": "2024-06-20T10:30:07+0530",
            "created_time_formatted": "20/06/2024 10:30 AM",
            "last_modified_time": "2024-06-20T10:30:09+0530",
            "is_viewed_by_client": false,
            "has_attachment": false,
            "client_viewed_time": "",
            "client_viewed_time_formatted": "",
            "is_emailed": false,
            "schedule_time": "",
            "schedule_time_formatted": "",
            "is_square_transaction": false,
            "is_pre_gst": false,
            "unprocessed_payment_amount": 0,
            "unprocessed_payment_amount_formatted": "₹0.00"
        },
        {
            "ach_payment_initiated": false,
            "ach_payment_initiated_formatted": false,
            "invoice_id": "168648000000764001",
            "customer_id": "168648000000111622",
            "customer_name": "aruneshwar",
            "status": "draft",
            "status_formatted": "Draft",
            "invoice_number": "INV-000069",
            "reference_number": "",
            "date": "2024-07-03",
            "date_formatted": "03/07/2024",
            "due_date": "2024-07-03",
            "due_date_formatted": "03/07/2024",
            "due_days": "",
            "type_formatted": "Tax Invoice",
            "type": "invoice",
            "total": 300,
            "total_formatted": "₹300.00",
            "balance": 300,
            "balance_formatted": "₹300.00",
            "created_time": "2024-07-03T06:28:29+0530",
            "created_time_formatted": "03/07/2024 06:28 AM",
            "last_modified_time": "2024-07-03T06:28:31+0530",
            "is_viewed_by_client": false,
            "has_attachment": false,
            "client_viewed_time": "",
            "client_viewed_time_formatted": "",
            "is_emailed": false,
            "schedule_time": "",
            "schedule_time_formatted": "",
            "is_square_transaction": false,
            "is_pre_gst": false,
            "unprocessed_payment_amount": 0,
            "unprocessed_payment_amount_formatted": "₹0.00"
        },
        {
            "ach_payment_initiated": false,
            "ach_payment_initiated_formatted": false,
            "invoice_id": "168648000000779003",
            "customer_id": "168648000000111622",
            "customer_name": "aruneshwar",
            "status": "rejected",
            "status_formatted": "Rejected",
            "invoice_number": "INV-000072",
            "reference_number": "",
            "date": "2024-07-10",
            "date_formatted": "10/07/2024",
            "due_date": "2024-07-10",
            "due_date_formatted": "10/07/2024",
            "due_days": "",
            "type_formatted": "Tax Invoice",
            "type": "invoice",
            "total": 300,
            "total_formatted": "₹300.00",
            "balance": 300,
            "balance_formatted": "₹300.00",
            "created_time": "2024-07-10T17:45:56+0530",
            "created_time_formatted": "10/07/2024 05:45 PM",
            "last_modified_time": "2024-07-10T17:46:39+0530",
            "is_viewed_by_client": false,
            "has_attachment": false,
            "client_viewed_time": "",
            "client_viewed_time_formatted": "",
            "is_emailed": false,
            "schedule_time": "",
            "schedule_time_formatted": "",
            "is_square_transaction": false,
            "is_pre_gst": false,
            "unprocessed_payment_amount": 0,
            "unprocessed_payment_amount_formatted": "₹0.00"
        },
        {
            "ach_payment_initiated": false,
            "ach_payment_initiated_formatted": false,
            "invoice_id": "168648000000789001",
            "customer_id": "168648000000111622",
            "customer_name": "aruneshwar",
            "status": "draft",
            "status_formatted": "Draft",
            "invoice_number": "INV-000074",
            "reference_number": "",
            "date": "2024-07-17",
            "date_formatted": "17/07/2024",
            "due_date": "2024-07-17",
            "due_date_formatted": "17/07/2024",
            "due_days": "",
            "type_formatted": "Tax Invoice",
            "type": "invoice",
            "total": 300,
            "total_formatted": "₹300.00",
            "balance": 300,
            "balance_formatted": "₹300.00",
            "created_time": "2024-07-17T06:05:31+0530",
            "created_time_formatted": "17/07/2024 06:05 AM",
            "last_modified_time": "2024-07-17T06:05:33+0530",
            "is_viewed_by_client": false,
            "has_attachment": false,
            "client_viewed_time": "",
            "client_viewed_time_formatted": "",
            "is_emailed": false,
            "schedule_time": "",
            "schedule_time_formatted": "",
            "is_square_transaction": false,
            "is_pre_gst": false,
            "unprocessed_payment_amount": 0,
            "unprocessed_payment_amount_formatted": "₹0.00"
        },
        {
            "ach_payment_initiated": false,
            "ach_payment_initiated_formatted": false,
            "invoice_id": "168648000002897009",
            "customer_id": "168648000000370001",
            "customer_name": "aruneshwar+1",
            "status": "draft",
            "status_formatted": "Draft",
            "invoice_number": "1234455",
            "reference_number": "",
            "date": "2026-01-05",
            "date_formatted": "05/01/2026",
            "due_date": "2026-01-05",
            "due_date_formatted": "05/01/2026",
            "due_days": "",
            "type_formatted": "Tax Invoice",
            "type": "invoice",
            "total": 300,
            "total_formatted": "₹300.00",
            "balance": 300,
            "balance_formatted": "₹300.00",
            "created_time": "2026-01-05T12:33:45+0530",
            "created_time_formatted": "05/01/2026 12:33 PM",
            "last_modified_time": "2026-01-05T12:33:45+0530",
            "is_viewed_by_client": false,
            "has_attachment": false,
            "client_viewed_time": "",
            "client_viewed_time_formatted": "",
            "is_emailed": false,
            "schedule_time": "",
            "schedule_time_formatted": "",
            "is_square_transaction": false,
            "is_pre_gst": false,
            "unprocessed_payment_amount": 0,
            "unprocessed_payment_amount_formatted": "₹0.00"
        },
        {
            "ach_payment_initiated": false,
            "ach_payment_initiated_formatted": false,
            "invoice_id": "168648000000882052",
            "customer_id": "168648000000111622",
            "customer_name": "aruneshwar",
            "status": "draft",
            "status_formatted": "Draft",
            "invoice_number": "INV-000077",
            "reference_number": "",
            "date": "2024-08-21",
            "date_formatted": "21/08/2024",
            "due_date": "2024-08-21",
            "due_date_formatted": "21/08/2024",
            "due_days": "",
            "type_formatted": "Tax Invoice",
            "type": "invoice",
            "total": 350,
            "total_formatted": "₹350.00",
            "balance": 350,
            "balance_formatted": "₹350.00",
            "created_time": "2024-08-21T14:52:06+0530",
            "created_time_formatted": "21/08/2024 02:52 PM",
            "last_modified_time": "2024-08-21T14:52:06+0530",
            "is_viewed_by_client": false,
            "has_attachment": false,
            "client_viewed_time": "",
            "client_viewed_time_formatted": "",
            "is_emailed": false,
            "schedule_time": "",
            "schedule_time_formatted": "",
            "is_square_transaction": false,
            "is_pre_gst": false,
            "unprocessed_payment_amount": 0,
            "unprocessed_payment_amount_formatted": "₹0.00"
        },
        {
            "ach_payment_initiated": false,
            "ach_payment_initiated_formatted": false,
            "invoice_id": "168648000001012072",
            "customer_id": "168648000000111622",
            "customer_name": "aruneshwar",
            "status": "approved",
            "status_formatted": "Approved",
            "invoice_number": "INV-000088",
            "reference_number": "",
            "date": "2024-10-28",
            "date_formatted": "28/10/2024",
            "due_date": "2024-10-28",
            "due_date_formatted": "28/10/2024",
            "due_days": "",
            "type_formatted": "Tax Invoice",
            "type": "invoice",
            "total": 350,
            "total_formatted": "₹350.00",
            "balance": 350,
            "balance_formatted": "₹350.00",
            "created_time": "2024-10-28T11:20:40+0530",
            "created_time_formatted": "28/10/2024 11:20 AM",
            "last_modified_time": "2025-04-21T11:23:39+0530",
            "is_viewed_by_client": false,
            "has_attachment": true,
            "client_viewed_time": "",
            "client_viewed_time_formatted": "",
            "is_emailed": false,
            "schedule_time": "",
            "schedule_time_formatted": "",
            "is_square_transaction": false,
            "is_pre_gst": false,
            "unprocessed_payment_amount": 0,
            "unprocessed_payment_amount_formatted": "₹0.00"
        },
        {
            "ach_payment_initiated": false,
            "ach_payment_initiated_formatted": false,
            "invoice_id": "168648000000776001",
            "customer_id": "168648000000111622",
            "customer_name": "aruneshwar",
            "status": "draft",
            "status_formatted": "Draft",
            "invoice_number": "INV-000071",
            "reference_number": "",
            "date": "2024-07-10",
            "date_formatted": "10/07/2024",
            "due_date": "2024-07-10",
            "due_date_formatted": "10/07/2024",
            "due_days": "",
            "type_formatted": "Tax Invoice",
            "type": "invoice",
            "total": 400,
            "total_formatted": "₹400.00",
            "balance": 400,
            "balance_formatted": "₹400.00",
            "created_time": "2024-07-10T06:13:16+0530",
            "created_time_formatted": "10/07/2024 06:13 AM",
            "last_modified_time": "2024-07-30T15:13:16+0530",
            "is_viewed_by_client": false,
            "has_attachment": false,
            "client_viewed_time": "",
            "client_viewed_time_formatted": "",
            "is_emailed": false,
            "schedule_time": "",
            "schedule_time_formatted": "",
            "is_square_transaction": false,
            "is_pre_gst": false,
            "unprocessed_payment_amount": 0,
            "unprocessed_payment_amount_formatted": "₹0.00"
        },
        {
            "ach_payment_initiated": false,
            "ach_payment_initiated_formatted": false,
            "invoice_id": "168648000002427082",
            "customer_id": "168648000000370001",
            "customer_name": "aruneshwar+1",
            "status": "overdue",
            "status_formatted": "Overdue",
            "invoice_number": "1762171077466",
            "reference_number": "",
            "date": "2025-11-03",
            "date_formatted": "03/11/2025",
            "due_date": "2025-11-03",
            "due_date_formatted": "03/11/2025",
            "due_days": "Overdue by 86 days",
            "type_formatted": "Tax Invoice",
            "type": "invoice",
            "total": 499,
            "total_formatted": "₹499.00",
            "balance": 499,
            "balance_formatted": "₹499.00",
            "created_time": "2025-11-03T17:27:59+0530",
            "created_time_formatted": "03/11/2025 05:27 PM",
            "last_modified_time": "2025-11-03T17:27:59+0530",
            "is_viewed_by_client": false,
            "has_attachment": false,
            "client_viewed_time": "",
            "client_viewed_time_formatted": "",
            "is_viewed_in_mail": false,
            "is_emailed": true,
            "mail_last_viewed_time": "",
            "mail_last_viewed_time_formatted": "",
            "schedule_time": "",
            "schedule_time_formatted": "",
            "is_square_transaction": false,
            "is_pre_gst": false,
            "unprocessed_payment_amount": 0,
            "unprocessed_payment_amount_formatted": "₹0.00"
        },
        {
            "ach_payment_initiated": false,
            "ach_payment_initiated_formatted": false,
            "invoice_id": "168648000002662003",
            "customer_id": "168648000000370001",
            "customer_name": "aruneshwar+1",
            "status": "overdue",
            "status_formatted": "Overdue",
            "invoice_number": "1764722529211",
            "reference_number": "",
            "date": "2025-12-03",
            "date_formatted": "03/12/2025",
            "due_date": "2025-12-03",
            "due_date_formatted": "03/12/2025",
            "due_days": "Overdue by 56 days",
            "type_formatted": "Tax Invoice",
            "type": "invoice",
            "total": 499,
            "total_formatted": "₹499.00",
            "balance": 499,
            "balance_formatted": "₹499.00",
            "created_time": "2025-12-03T06:12:09+0530",
            "created_time_formatted": "03/12/2025 06:12 AM",
            "last_modified_time": "2025-12-03T06:12:10+0530",
            "is_viewed_by_client": false,
            "has_attachment": false,
            "client_viewed_time": "",
            "client_viewed_time_formatted": "",
            "is_viewed_in_mail": false,
            "is_emailed": true,
            "mail_last_viewed_time": "",
            "mail_last_viewed_time_formatted": "",
            "schedule_time": "",
            "schedule_time_formatted": "",
            "is_square_transaction": false,
            "is_pre_gst": false,
            "unprocessed_payment_amount": 0,
            "unprocessed_payment_amount_formatted": "₹0.00"
        },
        {
            "ach_payment_initiated": false,
            "ach_payment_initiated_formatted": false,
            "invoice_id": "168648000002884007",
            "customer_id": "168648000000370001",
            "customer_name": "aruneshwar+1",
            "status": "overdue",
            "status_formatted": "Overdue",
            "invoice_number": "1767400417802",
            "reference_number": "",
            "date": "2026-01-03",
            "date_formatted": "03/01/2026",
            "due_date": "2026-01-03",
            "due_date_formatted": "03/01/2026",
            "due_days": "Overdue by 25 days",
            "type_formatted": "Tax Invoice",
            "type": "invoice",
            "total": 499,
            "total_formatted": "₹499.00",
            "balance": 499,
            "balance_formatted": "₹499.00",
            "created_time": "2026-01-03T06:03:38+0530",
            "created_time_formatted": "03/01/2026 06:03 AM",
            "last_modified_time": "2026-01-03T06:03:39+0530",
            "is_viewed_by_client": false,
            "has_attachment": false,
            "client_viewed_time": "",
            "client_viewed_time_formatted": "",
            "is_viewed_in_mail": false,
            "is_emailed": true,
            "mail_last_viewed_time": "",
            "mail_last_viewed_time_formatted": "",
            "schedule_time": "",
            "schedule_time_formatted": "",
            "is_square_transaction": false,
            "is_pre_gst": false,
            "unprocessed_payment_amount": 0,
            "unprocessed_payment_amount_formatted": "₹0.00"
        },
        {
            "ach_payment_initiated": false,
            "ach_payment_initiated_formatted": false,
            "invoice_id": "168648000002435005",
            "customer_id": "168648000000370001",
            "customer_name": "aruneshwar+1",
            "status": "overdue",
            "status_formatted": "Overdue",
            "invoice_number": "1762216764935",
            "reference_number": "",
            "date": "2025-11-04",
            "date_formatted": "04/11/2025",
            "due_date": "2025-11-04",
            "due_date_formatted": "04/11/2025",
            "due_days": "Overdue by 85 days",
            "type_formatted": "Tax Invoice",
            "type": "invoice",
            "total": 999,
            "total_formatted": "₹999.00",
            "balance": 999,
            "balance_formatted": "₹999.00",
            "created_time": "2025-11-04T06:09:25+0530",
            "created_time_formatted": "04/11/2025 06:09 AM",
            "last_modified_time": "2025-11-04T06:09:25+0530",
            "is_viewed_by_client": false,
            "has_attachment": false,
            "client_viewed_time": "",
            "client_viewed_time_formatted": "",
            "is_viewed_in_mail": false,
            "is_emailed": true,
            "mail_last_viewed_time": "",
            "mail_last_viewed_time_formatted": "",
            "schedule_time": "",
            "schedule_time_formatted": "",
            "is_square_transaction": false,
            "is_pre_gst": false,
            "unprocessed_payment_amount": 0,
            "unprocessed_payment_amount_formatted": "₹0.00"
        },
        {
            "ach_payment_initiated": false,
            "ach_payment_initiated_formatted": false,
            "invoice_id": "168648000002437038",
            "customer_id": "168648000000370001",
            "customer_name": "aruneshwar+1",
            "status": "overdue",
            "status_formatted": "Overdue",
            "invoice_number": "1762241973587",
            "reference_number": "",
            "date": "2025-11-04",
            "date_formatted": "04/11/2025",
            "due_date": "2025-11-04",
            "due_date_formatted": "04/11/2025",
            "due_days": "Overdue by 85 days",
            "type_formatted": "Tax Invoice",
            "type": "invoice",
            "total": 999,
            "total_formatted": "₹999.00",
            "balance": 999,
            "balance_formatted": "₹999.00",
            "created_time": "2025-11-04T13:09:35+0530",
            "created_time_formatted": "04/11/2025 01:09 PM",
            "last_modified_time": "2025-11-04T13:09:35+0530",
            "is_viewed_by_client": false,
            "has_attachment": false,
            "client_viewed_time": "",
            "client_viewed_time_formatted": "",
            "is_viewed_in_mail": false,
            "is_emailed": true,
            "mail_last_viewed_time": "",
            "mail_last_viewed_time_formatted": "",
            "schedule_time": "",
            "schedule_time_formatted": "",
            "is_square_transaction": false,
            "is_pre_gst": false,
            "unprocessed_payment_amount": 0,
            "unprocessed_payment_amount_formatted": "₹0.00"
        },
        {
            "ach_payment_initiated": false,
            "ach_payment_initiated_formatted": false,
            "invoice_id": "168648000002451003",
            "customer_id": "168648000000370001",
            "customer_name": "aruneshwar+1",
            "status": "overdue",
            "status_formatted": "Overdue",
            "invoice_number": "1762322686489",
            "reference_number": "",
            "date": "2025-11-05",
            "date_formatted": "05/11/2025",
            "due_date": "2025-11-05",
            "due_date_formatted": "05/11/2025",
            "due_days": "Overdue by 84 days",
            "type_formatted": "Tax Invoice",
            "type": "invoice",
            "total": 999,
            "total_formatted": "₹999.00",
            "balance": 999,
            "balance_formatted": "₹999.00",
            "created_time": "2025-11-05T11:34:46+0530",
            "created_time_formatted": "05/11/2025 11:34 AM",
            "last_modified_time": "2025-11-05T11:34:46+0530",
            "is_viewed_by_client": false,
            "has_attachment": false,
            "client_viewed_time": "",
            "client_viewed_time_formatted": "",
            "is_viewed_in_mail": false,
            "is_emailed": true,
            "mail_last_viewed_time": "",
            "mail_last_viewed_time_formatted": "",
            "schedule_time": "",
            "schedule_time_formatted": "",
            "is_square_transaction": false,
            "is_pre_gst": false,
            "unprocessed_payment_amount": 0,
            "unprocessed_payment_amount_formatted": "₹0.00"
        },
        {
            "ach_payment_initiated": false,
            "ach_payment_initiated_formatted": false,
            "invoice_id": "168648000002502003",
            "customer_id": "168648000000370001",
            "customer_name": "aruneshwar+1",
            "status": "overdue",
            "status_formatted": "Overdue",
            "invoice_number": "1762821555763",
            "reference_number": "",
            "date": "2025-11-11",
            "date_formatted": "11/11/2025",
            "due_date": "2025-11-11",
            "due_date_formatted": "11/11/2025",
            "due_days": "Overdue by 78 days",
            "type_formatted": "Tax Invoice",
            "type": "invoice",
            "total": 999,
            "total_formatted": "₹999.00",
            "balance": 999,
            "balance_formatted": "₹999.00",
            "created_time": "2025-11-11T06:09:16+0530",
            "created_time_formatted": "11/11/2025 06:09 AM",
            "last_modified_time": "2025-11-11T06:09:17+0530",
            "is_viewed_by_client": false,
            "has_attachment": false,
            "client_viewed_time": "",
            "client_viewed_time_formatted": "",
            "is_viewed_in_mail": false,
            "is_emailed": true,
            "mail_last_viewed_time": "",
            "mail_last_viewed_time_formatted": "",
            "schedule_time": "",
            "schedule_time_formatted": "",
            "is_square_transaction": false,
            "is_pre_gst": false,
            "unprocessed_payment_amount": 0,
            "unprocessed_payment_amount_formatted": "₹0.00"
        },
        {
            "ach_payment_initiated": false,
            "ach_payment_initiated_formatted": false,
            "invoice_id": "168648000002547003",
            "customer_id": "168648000000370001",
            "customer_name": "aruneshwar+1",
            "status": "overdue",
            "status_formatted": "Overdue",
            "invoice_number": "1763426926331",
            "reference_number": "",
            "date": "2025-11-18",
            "date_formatted": "18/11/2025",
            "due_date": "2025-11-18",
            "due_date_formatted": "18/11/2025",
            "due_days": "Overdue by 71 days",
            "type_formatted": "Tax Invoice",
            "type": "invoice",
            "total": 999,
            "total_formatted": "₹999.00",
            "balance": 999,
            "balance_formatted": "₹999.00",
            "created_time": "2025-11-18T06:18:47+0530",
            "created_time_formatted": "18/11/2025 06:18 AM",
            "last_modified_time": "2025-11-18T06:18:47+0530",
            "is_viewed_by_client": false,
            "has_attachment": false,
            "client_viewed_time": "",
            "client_viewed_time_formatted": "",
            "is_viewed_in_mail": false,
            "is_emailed": true,
            "mail_last_viewed_time": "",
            "mail_last_viewed_time_formatted": "",
            "schedule_time": "",
            "schedule_time_formatted": "",
            "is_square_transaction": false,
            "is_pre_gst": false,
            "unprocessed_payment_amount": 0,
            "unprocessed_payment_amount_formatted": "₹0.00"
        },
        {
            "ach_payment_initiated": false,
            "ach_payment_initiated_formatted": false,
            "invoice_id": "168648000002591003",
            "customer_id": "168648000000370001",
            "customer_name": "aruneshwar+1",
            "status": "overdue",
            "status_formatted": "Overdue",
            "invoice_number": "1764031479723",
            "reference_number": "",
            "date": "2025-11-25",
            "date_formatted": "25/11/2025",
            "due_date": "2025-11-25",
            "due_date_formatted": "25/11/2025",
            "due_days": "Overdue by 64 days",
            "type_formatted": "Tax Invoice",
            "type": "invoice",
            "total": 999,
            "total_formatted": "₹999.00",
            "balance": 999,
            "balance_formatted": "₹999.00",
            "created_time": "2025-11-25T06:14:40+0530",
            "created_time_formatted": "25/11/2025 06:14 AM",
            "last_modified_time": "2025-11-25T06:14:42+0530",
            "is_viewed_by_client": false,
            "has_attachment": false,
            "client_viewed_time": "",
            "client_viewed_time_formatted": "",
            "is_viewed_in_mail": false,
            "is_emailed": true,
            "mail_last_viewed_time": "",
            "mail_last_viewed_time_formatted": "",
            "schedule_time": "",
            "schedule_time_formatted": "",
            "is_square_transaction": false,
            "is_pre_gst": false,
            "unprocessed_payment_amount": 0,
            "unprocessed_payment_amount_formatted": "₹0.00"
        },
        {
            "ach_payment_initiated": false,
            "ach_payment_initiated_formatted": false,
            "invoice_id": "168648000002635066",
            "customer_id": "168648000000370001",
            "customer_name": "aruneshwar+1",
            "status": "overdue",
            "status_formatted": "Overdue",
            "invoice_number": "1764637204894",
            "reference_number": "",
            "date": "2025-12-02",
            "date_formatted": "02/12/2025",
            "due_date": "2025-12-02",
            "due_date_formatted": "02/12/2025",
            "due_days": "Overdue by 57 days",
            "type_formatted": "Tax Invoice",
            "type": "invoice",
            "total": 999,
            "total_formatted": "₹999.00",
            "balance": 999,
            "balance_formatted": "₹999.00",
            "created_time": "2025-12-02T06:30:05+0530",
            "created_time_formatted": "02/12/2025 06:30 AM",
            "last_modified_time": "2025-12-02T06:30:05+0530",
            "is_viewed_by_client": false,
            "has_attachment": false,
            "client_viewed_time": "",
            "client_viewed_time_formatted": "",
            "is_viewed_in_mail": false,
            "is_emailed": true,
            "mail_last_viewed_time": "",
            "mail_last_viewed_time_formatted": "",
            "schedule_time": "",
            "schedule_time_formatted": "",
            "is_square_transaction": false,
            "is_pre_gst": false,
            "unprocessed_payment_amount": 0,
            "unprocessed_payment_amount_formatted": "₹0.00"
        },
        {
            "ach_payment_initiated": false,
            "ach_payment_initiated_formatted": false,
            "invoice_id": "168648000002705003",
            "customer_id": "168648000000370001",
            "customer_name": "aruneshwar+1",
            "status": "overdue",
            "status_formatted": "Overdue",
            "invoice_number": "1765241659155",
            "reference_number": "",
            "date": "2025-12-09",
            "date_formatted": "09/12/2025",
            "due_date": "2025-12-09",
            "due_date_formatted": "09/12/2025",
            "due_days": "Overdue by 50 days",
            "type_formatted": "Tax Invoice",
            "type": "invoice",
            "total": 999,
            "total_formatted": "₹999.00",
            "balance": 999,
            "balance_formatted": "₹999.00",
            "created_time": "2025-12-09T06:24:19+0530",
            "created_time_formatted": "09/12/2025 06:24 AM",
            "last_modified_time": "2025-12-09T06:24:21+0530",
            "is_viewed_by_client": false,
            "has_attachment": false,
            "client_viewed_time": "",
            "client_viewed_time_formatted": "",
            "is_viewed_in_mail": false,
            "is_emailed": true,
            "mail_last_viewed_time": "",
            "mail_last_viewed_time_formatted": "",
            "schedule_time": "",
            "schedule_time_formatted": "",
            "is_square_transaction": false,
            "is_pre_gst": false,
            "unprocessed_payment_amount": 0,
            "unprocessed_payment_amount_formatted": "₹0.00"
        },
        {
            "ach_payment_initiated": false,
            "ach_payment_initiated_formatted": false,
            "invoice_id": "168648000002757003",
            "customer_id": "168648000000370001",
            "customer_name": "aruneshwar+1",
            "status": "overdue",
            "status_formatted": "Overdue",
            "invoice_number": "1765846627311",
            "reference_number": "",
            "date": "2025-12-16",
            "date_formatted": "16/12/2025",
            "due_date": "2025-12-16",
            "due_date_formatted": "16/12/2025",
            "due_days": "Overdue by 43 days",
            "type_formatted": "Tax Invoice",
            "type": "invoice",
            "total": 999,
            "total_formatted": "₹999.00",
            "balance": 999,
            "balance_formatted": "₹999.00",
            "created_time": "2025-12-16T06:27:07+0530",
            "created_time_formatted": "16/12/2025 06:27 AM",
            "last_modified_time": "2025-12-16T06:27:08+0530",
            "is_viewed_by_client": false,
            "has_attachment": false,
            "client_viewed_time": "",
            "client_viewed_time_formatted": "",
            "is_viewed_in_mail": false,
            "is_emailed": true,
            "mail_last_viewed_time": "",
            "mail_last_viewed_time_formatted": "",
            "schedule_time": "",
            "schedule_time_formatted": "",
            "is_square_transaction": false,
            "is_pre_gst": false,
            "unprocessed_payment_amount": 0,
            "unprocessed_payment_amount_formatted": "₹0.00"
        },
        {
            "ach_payment_initiated": false,
            "ach_payment_initiated_formatted": false,
            "invoice_id": "168648000002810003",
            "customer_id": "168648000000370001",
            "customer_name": "aruneshwar+1",
            "status": "overdue",
            "status_formatted": "Overdue",
            "invoice_number": "1766450677215",
            "reference_number": "",
            "date": "2025-12-23",
            "date_formatted": "23/12/2025",
            "due_date": "2025-12-23",
            "due_date_formatted": "23/12/2025",
            "due_days": "Overdue by 36 days",
            "type_formatted": "Tax Invoice",
            "type": "invoice",
            "total": 999,
            "total_formatted": "₹999.00",
            "balance": 999,
            "balance_formatted": "₹999.00",
            "created_time": "2025-12-23T06:14:37+0530",
            "created_time_formatted": "23/12/2025 06:14 AM",
            "last_modified_time": "2025-12-23T06:14:38+0530",
            "is_viewed_by_client": false,
            "has_attachment": false,
            "client_viewed_time": "",
            "client_viewed_time_formatted": "",
            "is_viewed_in_mail": false,
            "is_emailed": true,
            "mail_last_viewed_time": "",
            "mail_last_viewed_time_formatted": "",
            "schedule_time": "",
            "schedule_time_formatted": "",
            "is_square_transaction": false,
            "is_pre_gst": false,
            "unprocessed_payment_amount": 0,
            "unprocessed_payment_amount_formatted": "₹0.00"
        },
        {
            "ach_payment_initiated": false,
            "ach_payment_initiated_formatted": false,
            "invoice_id": "168648000002857003",
            "customer_id": "168648000000370001",
            "customer_name": "aruneshwar+1",
            "status": "overdue",
            "status_formatted": "Overdue",
            "invoice_number": "1767055042405",
            "reference_number": "",
            "date": "2025-12-30",
            "date_formatted": "30/12/2025",
            "due_date": "2025-12-30",
            "due_date_formatted": "30/12/2025",
            "due_days": "Overdue by 29 days",
            "type_formatted": "Tax Invoice",
            "type": "invoice",
            "total": 999,
            "total_formatted": "₹999.00",
            "balance": 999,
            "balance_formatted": "₹999.00",
            "created_time": "2025-12-30T06:07:22+0530",
            "created_time_formatted": "30/12/2025 06:07 AM",
            "last_modified_time": "2025-12-30T06:07:23+0530",
            "is_viewed_by_client": false,
            "has_attachment": false,
            "client_viewed_time": "",
            "client_viewed_time_formatted": "",
            "is_viewed_in_mail": false,
            "is_emailed": true,
            "mail_last_viewed_time": "",
            "mail_last_viewed_time_formatted": "",
            "schedule_time": "",
            "schedule_time_formatted": "",
            "is_square_transaction": false,
            "is_pre_gst": false,
            "unprocessed_payment_amount": 0,
            "unprocessed_payment_amount_formatted": "₹0.00"
        },
        {
            "ach_payment_initiated": false,
            "ach_payment_initiated_formatted": false,
            "invoice_id": "168648000002908007",
            "customer_id": "168648000000370001",
            "customer_name": "aruneshwar+1",
            "status": "overdue",
            "status_formatted": "Overdue",
            "invoice_number": "1767660880603",
            "reference_number": "",
            "date": "2026-01-06",
            "date_formatted": "06/01/2026",
            "due_date": "2026-01-06",
            "due_date_formatted": "06/01/2026",
            "due_days": "Overdue by 22 days",
            "type_formatted": "Tax Invoice",
            "type": "invoice",
            "total": 999,
            "total_formatted": "₹999.00",
            "balance": 999,
            "balance_formatted": "₹999.00",
            "created_time": "2026-01-06T06:24:40+0530",
            "created_time_formatted": "06/01/2026 06:24 AM",
            "last_modified_time": "2026-01-06T06:24:41+0530",
            "is_viewed_by_client": false,
            "has_attachment": false,
            "client_viewed_time": "",
            "client_viewed_time_formatted": "",
            "is_viewed_in_mail": false,
            "is_emailed": true,
            "mail_last_viewed_time": "",
            "mail_last_viewed_time_formatted": "",
            "schedule_time": "",
            "schedule_time_formatted": "",
            "is_square_transaction": false,
            "is_pre_gst": false,
            "unprocessed_payment_amount": 0,
            "unprocessed_payment_amount_formatted": "₹0.00"
        },
        {
            "ach_payment_initiated": false,
            "ach_payment_initiated_formatted": false,
            "invoice_id": "168648000002956007",
            "customer_id": "168648000000370001",
            "customer_name": "aruneshwar+1",
            "status": "overdue",
            "status_formatted": "Overdue",
            "invoice_number": "1768265113193",
            "reference_number": "",
            "date": "2026-01-13",
            "date_formatted": "13/01/2026",
            "due_date": "2026-01-13",
            "due_date_formatted": "13/01/2026",
            "due_days": "Overdue by 15 days",
            "type_formatted": "Tax Invoice",
            "type": "invoice",
            "total": 999,
            "total_formatted": "₹999.00",
            "balance": 999,
            "balance_formatted": "₹999.00",
            "created_time": "2026-01-13T06:15:13+0530",
            "created_time_formatted": "13/01/2026 06:15 AM",
            "last_modified_time": "2026-01-13T06:15:14+0530",
            "is_viewed_by_client": false,
            "has_attachment": false,
            "client_viewed_time": "",
            "client_viewed_time_formatted": "",
            "is_viewed_in_mail": false,
            "is_emailed": true,
            "mail_last_viewed_time": "",
            "mail_last_viewed_time_formatted": "",
            "schedule_time": "",
            "schedule_time_formatted": "",
            "is_square_transaction": false,
            "is_pre_gst": false,
            "unprocessed_payment_amount": 0,
            "unprocessed_payment_amount_formatted": "₹0.00"
        },
        {
            "ach_payment_initiated": false,
            "ach_payment_initiated_formatted": false,
            "invoice_id": "168648000003001007",
            "customer_id": "168648000000370001",
            "customer_name": "aruneshwar+1",
            "status": "overdue",
            "status_formatted": "Overdue",
            "invoice_number": "1768869762729",
            "reference_number": "",
            "date": "2026-01-20",
            "date_formatted": "20/01/2026",
            "due_date": "2026-01-20",
            "due_date_formatted": "20/01/2026",
            "due_days": "Overdue by 8 days",
            "type_formatted": "Tax Invoice",
            "type": "invoice",
            "total": 999,
            "total_formatted": "₹999.00",
            "balance": 999,
            "balance_formatted": "₹999.00",
            "created_time": "2026-01-20T06:12:43+0530",
            "created_time_formatted": "20/01/2026 06:12 AM",
            "last_modified_time": "2026-01-20T06:12:44+0530",
            "is_viewed_by_client": false,
            "has_attachment": false,
            "client_viewed_time": "",
            "client_viewed_time_formatted": "",
            "is_viewed_in_mail": false,
            "is_emailed": true,
            "mail_last_viewed_time": "",
            "mail_last_viewed_time_formatted": "",
            "schedule_time": "",
            "schedule_time_formatted": "",
            "is_square_transaction": false,
            "is_pre_gst": false,
            "unprocessed_payment_amount": 0,
            "unprocessed_payment_amount_formatted": "₹0.00"
        },
        {
            "ach_payment_initiated": false,
            "ach_payment_initiated_formatted": false,
            "invoice_id": "168648000003044007",
            "customer_id": "168648000000370001",
            "customer_name": "aruneshwar+1",
            "status": "overdue",
            "status_formatted": "Overdue",
            "invoice_number": "1769475524444",
            "reference_number": "",
            "date": "2026-01-27",
            "date_formatted": "27/01/2026",
            "due_date": "2026-01-27",
            "due_date_formatted": "27/01/2026",
            "due_days": "Overdue by 1 day",
            "type_formatted": "Tax Invoice",
            "type": "invoice",
            "total": 999,
            "total_formatted": "₹999.00",
            "balance": 999,
            "balance_formatted": "₹999.00",
            "created_time": "2026-01-27T06:28:44+0530",
            "created_time_formatted": "27/01/2026 06:28 AM",
            "last_modified_time": "2026-01-27T06:28:46+0530",
            "is_viewed_by_client": false,
            "has_attachment": false,
            "client_viewed_time": "",
            "client_viewed_time_formatted": "",
            "is_viewed_in_mail": false,
            "is_emailed": true,
            "mail_last_viewed_time": "",
            "mail_last_viewed_time_formatted": "",
            "schedule_time": "",
            "schedule_time_formatted": "",
            "is_square_transaction": false,
            "is_pre_gst": false,
            "unprocessed_payment_amount": 0,
            "unprocessed_payment_amount_formatted": "₹0.00"
        },
        {
            "ach_payment_initiated": false,
            "ach_payment_initiated_formatted": false,
            "invoice_id": "168648000000111649",
            "customer_id": "168648000000111622",
            "customer_name": "aruneshwar",
            "status": "paid",
            "status_formatted": "Paid",
            "invoice_number": "INV-000002",
            "reference_number": "999999",
            "date": "2023-07-24",
            "date_formatted": "24/07/2023",
            "due_date": "2023-07-24",
            "due_date_formatted": "24/07/2023",
            "due_days": "",
            "type_formatted": "Tax Invoice",
            "type": "invoice",
            "total": 1000,
            "total_formatted": "₹1,000.00",
            "balance": 0,
            "balance_formatted": "₹0.00",
            "created_time": "2023-07-24T17:29:14+0530",
            "created_time_formatted": "24/07/2023 05:29 PM",
            "last_modified_time": "2023-07-27T18:23:27+0530",
            "is_viewed_by_client": false,
            "has_attachment": false,
            "client_viewed_time": "",
            "client_viewed_time_formatted": "",
            "is_viewed_in_mail": false,
            "is_emailed": true,
            "mail_last_viewed_time": "",
            "mail_last_viewed_time_formatted": "",
            "schedule_time": "",
            "schedule_time_formatted": "",
            "is_square_transaction": false,
            "is_pre_gst": false,
            "unprocessed_payment_amount": 0,
            "unprocessed_payment_amount_formatted": "₹0.00"
        },
        {
            "ach_payment_initiated": false,
            "ach_payment_initiated_formatted": false,
            "invoice_id": "168648000000882018",
            "customer_id": "168648000000111622",
            "customer_name": "aruneshwar",
            "status": "draft",
            "status_formatted": "Draft",
            "invoice_number": "INV-000076",
            "reference_number": "",
            "date": "2024-08-21",
            "date_formatted": "21/08/2024",
            "due_date": "2024-08-21",
            "due_date_formatted": "21/08/2024",
            "due_days": "",
            "type_formatted": "Tax Invoice",
            "type": "invoice",
            "total": 1850,
            "total_formatted": "₹1,850.00",
            "balance": 1850,
            "balance_formatted": "₹1,850.00",
            "created_time": "2024-08-21T14:50:42+0530",
            "created_time_formatted": "21/08/2024 02:50 PM",
            "last_modified_time": "2024-08-21T14:50:42+0530",
            "is_viewed_by_client": false,
            "has_attachment": false,
            "client_viewed_time": "",
            "client_viewed_time_formatted": "",
            "is_emailed": false,
            "schedule_time": "",
            "schedule_time_formatted": "",
            "is_square_transaction": false,
            "is_pre_gst": false,
            "unprocessed_payment_amount": 0,
            "unprocessed_payment_amount_formatted": "₹0.00"
        },
        {
            "ach_payment_initiated": false,
            "ach_payment_initiated_formatted": false,
            "invoice_id": "168648000000326055",
            "customer_id": "168648000000111622",
            "customer_name": "aruneshwar",
            "status": "draft",
            "status_formatted": "Draft",
            "invoice_number": "INV-000021",
            "reference_number": "",
            "date": "2023-11-30",
            "date_formatted": "30/11/2023",
            "due_date": "2023-11-30",
            "due_date_formatted": "30/11/2023",
            "due_days": "",
            "type_formatted": "Tax Invoice",
            "type": "invoice",
            "total": 2000,
            "total_formatted": "₹2,000.00",
            "balance": 2000,
            "balance_formatted": "₹2,000.00",
            "created_time": "2023-11-30T12:24:33+0530",
            "created_time_formatted": "30/11/2023 12:24 PM",
            "last_modified_time": "2023-11-30T12:24:33+0530",
            "is_viewed_by_client": false,
            "has_attachment": false,
            "client_viewed_time": "",
            "client_viewed_time_formatted": "",
            "is_emailed": false,
            "schedule_time": "",
            "schedule_time_formatted": "",
            "is_square_transaction": false,
            "is_pre_gst": false,
            "unprocessed_payment_amount": 0,
            "unprocessed_payment_amount_formatted": "₹0.00"
        },
        {
            "ach_payment_initiated": false,
            "ach_payment_initiated_formatted": false,
            "invoice_id": "168648000000387001",
            "customer_id": "168648000000111622",
            "customer_name": "aruneshwar",
            "status": "draft",
            "status_formatted": "Draft",
            "invoice_number": "INV-000027",
            "reference_number": "",
            "date": "2023-12-30",
            "date_formatted": "30/12/2023",
            "due_date": "2023-12-30",
            "due_date_formatted": "30/12/2023",
            "due_days": "",
            "type_formatted": "Tax Invoice",
            "type": "invoice",
            "total": 2000,
            "total_formatted": "₹2,000.00",
            "balance": 2000,
            "balance_formatted": "₹2,000.00",
            "created_time": "2023-12-30T06:28:42+0530",
            "created_time_formatted": "30/12/2023 06:28 AM",
            "last_modified_time": "2023-12-30T06:28:43+0530",
            "is_viewed_by_client": false,
            "has_attachment": false,
            "client_viewed_time": "",
            "client_viewed_time_formatted": "",
            "is_emailed": false,
            "schedule_time": "",
            "schedule_time_formatted": "",
            "is_square_transaction": false,
            "is_pre_gst": false,
            "unprocessed_payment_amount": 0,
            "unprocessed_payment_amount_formatted": "₹0.00"
        },
        {
            "ach_payment_initiated": false,
            "ach_payment_initiated_formatted": false,
            "invoice_id": "168648000000435001",
            "customer_id": "168648000000111622",
            "customer_name": "aruneshwar",
            "status": "draft",
            "status_formatted": "Draft",
            "invoice_number": "INV-000036",
            "reference_number": "",
            "date": "2024-01-30",
            "date_formatted": "30/01/2024",
            "due_date": "2024-01-30",
            "due_date_formatted": "30/01/2024",
            "due_days": "",
            "type_formatted": "Tax Invoice",
            "type": "invoice",
            "total": 2000,
            "total_formatted": "₹2,000.00",
            "balance": 2000,
            "balance_formatted": "₹2,000.00",
            "created_time": "2024-01-30T10:59:19+0530",
            "created_time_formatted": "30/01/2024 10:59 AM",
            "last_modified_time": "2024-01-30T10:59:22+0530",
            "is_viewed_by_client": false,
            "has_attachment": false,
            "client_viewed_time": "",
            "client_viewed_time_formatted": "",
            "is_emailed": false,
            "schedule_time": "",
            "schedule_time_formatted": "",
            "is_square_transaction": false,
            "is_pre_gst": false,
            "unprocessed_payment_amount": 0,
            "unprocessed_payment_amount_formatted": "₹0.00"
        },
        {
            "ach_payment_initiated": false,
            "ach_payment_initiated_formatted": false,
            "invoice_id": "168648000000498003",
            "customer_id": "168648000000111622",
            "customer_name": "aruneshwar",
            "status": "draft",
            "status_formatted": "Draft",
            "invoice_number": "INV-000044",
            "reference_number": "",
            "date": "2024-02-29",
            "date_formatted": "29/02/2024",
            "due_date": "2024-02-29",
            "due_date_formatted": "29/02/2024",
            "due_days": "",
            "type_formatted": "Tax Invoice",
            "type": "invoice",
            "total": 2000,
            "total_formatted": "₹2,000.00",
            "balance": 2000,
            "balance_formatted": "₹2,000.00",
            "created_time": "2024-02-29T06:07:41+0530",
            "created_time_formatted": "29/02/2024 06:07 AM",
            "last_modified_time": "2024-02-29T06:07:42+0530",
            "is_viewed_by_client": false,
            "has_attachment": false,
            "client_viewed_time": "",
            "client_viewed_time_formatted": "",
            "is_emailed": false,
            "schedule_time": "",
            "schedule_time_formatted": "",
            "is_square_transaction": false,
            "is_pre_gst": false,
            "unprocessed_payment_amount": 0,
            "unprocessed_payment_amount_formatted": "₹0.00"
        },
        {
            "ach_payment_initiated": false,
            "ach_payment_initiated_formatted": false,
            "invoice_id": "168648000000558003",
            "customer_id": "168648000000111622",
            "customer_name": "aruneshwar",
            "status": "draft",
            "status_formatted": "Draft",
            "invoice_number": "INV-000049",
            "reference_number": "",
            "date": "2024-03-30",
            "date_formatted": "30/03/2024",
            "due_date": "2024-03-30",
            "due_date_formatted": "30/03/2024",
            "due_days": "",
            "type_formatted": "Tax Invoice",
            "type": "invoice",
            "total": 2000,
            "total_formatted": "₹2,000.00",
            "balance": 2000,
            "balance_formatted": "₹2,000.00",
            "created_time": "2024-03-30T06:08:41+0530",
            "created_time_formatted": "30/03/2024 06:08 AM",
            "last_modified_time": "2024-03-30T06:08:42+0530",
            "is_viewed_by_client": false,
            "has_attachment": false,
            "client_viewed_time": "",
            "client_viewed_time_formatted": "",
            "is_emailed": false,
            "schedule_time": "",
            "schedule_time_formatted": "",
            "is_square_transaction": false,
            "is_pre_gst": false,
            "unprocessed_payment_amount": 0,
            "unprocessed_payment_amount_formatted": "₹0.00"
        },
        {
            "ach_payment_initiated": false,
            "ach_payment_initiated_formatted": false,
            "invoice_id": "168648000000619005",
            "customer_id": "168648000000111622",
            "customer_name": "aruneshwar",
            "status": "draft",
            "status_formatted": "Draft",
            "invoice_number": "INV-000054",
            "reference_number": "",
            "date": "2024-04-30",
            "date_formatted": "30/04/2024",
            "due_date": "2024-04-30",
            "due_date_formatted": "30/04/2024",
            "due_days": "",
            "type_formatted": "Tax Invoice",
            "type": "invoice",
            "total": 2000,
            "total_formatted": "₹2,000.00",
            "balance": 2000,
            "balance_formatted": "₹2,000.00",
            "created_time": "2024-04-30T06:00:19+0530",
            "created_time_formatted": "30/04/2024 06:00 AM",
            "last_modified_time": "2024-04-30T06:00:20+0530",
            "is_viewed_by_client": false,
            "has_attachment": false,
            "client_viewed_time": "",
            "client_viewed_time_formatted": "",
            "is_emailed": false,
            "schedule_time": "",
            "schedule_time_formatted": "",
            "is_square_transaction": false,
            "is_pre_gst": false,
            "unprocessed_payment_amount": 0,
            "unprocessed_payment_amount_formatted": "₹0.00"
        },
        {
            "ach_payment_initiated": false,
            "ach_payment_initiated_formatted": false,
            "invoice_id": "168648000000690001",
            "customer_id": "168648000000111622",
            "customer_name": "aruneshwar",
            "status": "draft",
            "status_formatted": "Draft",
            "invoice_number": "INV-000060",
            "reference_number": "",
            "date": "2024-05-30",
            "date_formatted": "30/05/2024",
            "due_date": "2024-05-30",
            "due_date_formatted": "30/05/2024",
            "due_days": "",
            "type_formatted": "Tax Invoice",
            "type": "invoice",
            "total": 2000,
            "total_formatted": "₹2,000.00",
            "balance": 2000,
            "balance_formatted": "₹2,000.00",
            "created_time": "2024-05-30T06:18:46+0530",
            "created_time_formatted": "30/05/2024 06:18 AM",
            "last_modified_time": "2024-05-30T06:18:48+0530",
            "is_viewed_by_client": false,
            "has_attachment": false,
            "client_viewed_time": "",
            "client_viewed_time_formatted": "",
            "is_emailed": false,
            "schedule_time": "",
            "schedule_time_formatted": "",
            "is_square_transaction": false,
            "is_pre_gst": false,
            "unprocessed_payment_amount": 0,
            "unprocessed_payment_amount_formatted": "₹0.00"
        },
        {
            "ach_payment_initiated": false,
            "ach_payment_initiated_formatted": false,
            "invoice_id": "168648000000757001",
            "customer_id": "168648000000111622",
            "customer_name": "aruneshwar",
            "status": "draft",
            "status_formatted": "Draft",
            "invoice_number": "INV-000068",
            "reference_number": "",
            "date": "2024-06-30",
            "date_formatted": "30/06/2024",
            "due_date": "2024-06-30",
            "due_date_formatted": "30/06/2024",
            "due_days": "",
            "type_formatted": "Tax Invoice",
            "type": "invoice",
            "total": 2000,
            "total_formatted": "₹2,000.00",
            "balance": 2000,
            "balance_formatted": "₹2,000.00",
            "created_time": "2024-06-30T06:27:52+0530",
            "created_time_formatted": "30/06/2024 06:27 AM",
            "last_modified_time": "2024-06-30T06:27:54+0530",
            "is_viewed_by_client": false,
            "has_attachment": false,
            "client_viewed_time": "",
            "client_viewed_time_formatted": "",
            "is_emailed": false,
            "schedule_time": "",
            "schedule_time_formatted": "",
            "is_square_transaction": false,
            "is_pre_gst": false,
            "unprocessed_payment_amount": 0,
            "unprocessed_payment_amount_formatted": "₹0.00"
        },
        {
            "ach_payment_initiated": false,
            "ach_payment_initiated_formatted": false,
            "invoice_id": "168648000001137027",
            "customer_id": "168648000000370001",
            "customer_name": "aruneshwar+1",
            "status": "overdue",
            "status_formatted": "Overdue",
            "invoice_number": "INV-000089",
            "reference_number": "",
            "date": "2025-01-08",
            "date_formatted": "08/01/2025",
            "due_date": "2025-01-08",
            "due_date_formatted": "08/01/2025",
            "due_days": "Overdue by 385 days",
            "type_formatted": "Tax Invoice",
            "type": "invoice",
            "total": 2000,
            "total_formatted": "₹2,000.00",
            "balance": 2000,
            "balance_formatted": "₹2,000.00",
            "created_time": "2025-01-08T13:27:05+0530",
            "created_time_formatted": "08/01/2025 01:27 PM",
            "last_modified_time": "2025-12-11T11:12:17+0530",
            "is_viewed_by_client": true,
            "has_attachment": false,
            "client_viewed_time": "2025-12-11",
            "client_viewed_time_formatted": "11/12/2025 11:12 AM",
            "is_viewed_in_mail": false,
            "is_emailed": true,
            "mail_last_viewed_time": "",
            "mail_last_viewed_time_formatted": "",
            "schedule_time": "",
            "schedule_time_formatted": "",
            "is_square_transaction": false,
            "is_pre_gst": false,
            "unprocessed_payment_amount": 0,
            "unprocessed_payment_amount_formatted": "₹0.00"
        },
        {
            "ach_payment_initiated": false,
            "ach_payment_initiated_formatted": false,
            "invoice_id": "168648000002396050",
            "customer_id": "168648000000370001",
            "customer_name": "aruneshwar+1",
            "status": "overdue",
            "status_formatted": "Overdue",
            "invoice_number": "1761893885785",
            "reference_number": "",
            "date": "2025-10-31",
            "date_formatted": "31/10/2025",
            "due_date": "2025-10-31",
            "due_date_formatted": "31/10/2025",
            "due_days": "Overdue by 89 days",
            "type_formatted": "Tax Invoice",
            "type": "invoice",
            "total": 2000,
            "total_formatted": "₹2,000.00",
            "balance": 2000,
            "balance_formatted": "₹2,000.00",
            "created_time": "2025-10-31T12:28:07+0530",
            "created_time_formatted": "31/10/2025 12:28 PM",
            "last_modified_time": "2025-10-31T12:28:07+0530",
            "is_viewed_by_client": false,
            "has_attachment": false,
            "client_viewed_time": "",
            "client_viewed_time_formatted": "",
            "is_viewed_in_mail": false,
            "is_emailed": true,
            "mail_last_viewed_time": "",
            "mail_last_viewed_time_formatted": "",
            "schedule_time": "",
            "schedule_time_formatted": "",
            "is_square_transaction": false,
            "is_pre_gst": false,
            "unprocessed_payment_amount": 0,
            "unprocessed_payment_amount_formatted": "₹0.00"
        },
        {
            "ach_payment_initiated": false,
            "ach_payment_initiated_formatted": false,
            "invoice_id": "168648000002635003",
            "customer_id": "168648000000370001",
            "customer_name": "aruneshwar+1",
            "status": "overdue",
            "status_formatted": "Overdue",
            "invoice_number": "1764464017231",
            "reference_number": "",
            "date": "2025-11-30",
            "date_formatted": "30/11/2025",
            "due_date": "2025-11-30",
            "due_date_formatted": "30/11/2025",
            "due_days": "Overdue by 59 days",
            "type_formatted": "Tax Invoice",
            "type": "invoice",
            "total": 2000,
            "total_formatted": "₹2,000.00",
            "balance": 2000,
            "balance_formatted": "₹2,000.00",
            "created_time": "2025-11-30T06:23:37+0530",
            "created_time_formatted": "30/11/2025 06:23 AM",
            "last_modified_time": "2025-11-30T06:23:38+0530",
            "is_viewed_by_client": false,
            "has_attachment": false,
            "client_viewed_time": "",
            "client_viewed_time_formatted": "",
            "is_viewed_in_mail": false,
            "is_emailed": true,
            "mail_last_viewed_time": "",
            "mail_last_viewed_time_formatted": "",
            "schedule_time": "",
            "schedule_time_formatted": "",
            "is_square_transaction": false,
            "is_pre_gst": false,
            "unprocessed_payment_amount": 0,
            "unprocessed_payment_amount_formatted": "₹0.00"
        },
        {
            "ach_payment_initiated": false,
            "ach_payment_initiated_formatted": false,
            "invoice_id": "168648000002857066",
            "customer_id": "168648000000370001",
            "customer_name": "aruneshwar+1",
            "status": "overdue",
            "status_formatted": "Overdue",
            "invoice_number": "1767141813097",
            "reference_number": "",
            "date": "2025-12-31",
            "date_formatted": "31/12/2025",
            "due_date": "2025-12-31",
            "due_date_formatted": "31/12/2025",
            "due_days": "Overdue by 28 days",
            "type_formatted": "Tax Invoice",
            "type": "invoice",
            "total": 2000,
            "total_formatted": "₹2,000.00",
            "balance": 2000,
            "balance_formatted": "₹2,000.00",
            "created_time": "2025-12-31T06:13:33+0530",
            "created_time_formatted": "31/12/2025 06:13 AM",
            "last_modified_time": "2025-12-31T06:13:34+0530",
            "is_viewed_by_client": false,
            "has_attachment": false,
            "client_viewed_time": "",
            "client_viewed_time_formatted": "",
            "is_viewed_in_mail": false,
            "is_emailed": true,
            "mail_last_viewed_time": "",
            "mail_last_viewed_time_formatted": "",
            "schedule_time": "",
            "schedule_time_formatted": "",
            "is_square_transaction": false,
            "is_pre_gst": false,
            "unprocessed_payment_amount": 0,
            "unprocessed_payment_amount_formatted": "₹0.00"
        },
        {
            "ach_payment_initiated": false,
            "ach_payment_initiated_formatted": false,
            "invoice_id": "168648000000882084",
            "customer_id": "168648000000111622",
            "customer_name": "aruneshwar",
            "status": "approved",
            "status_formatted": "Approved",
            "invoice_number": "INV-000078",
            "reference_number": "",
            "date": "2024-08-21",
            "date_formatted": "21/08/2024",
            "due_date": "2024-08-21",
            "due_date_formatted": "21/08/2024",
            "due_days": "",
            "type_formatted": "Tax Invoice",
            "type": "invoice",
            "total": 3500,
            "total_formatted": "₹3,500.00",
            "balance": 3500,
            "balance_formatted": "₹3,500.00",
            "created_time": "2024-08-21T14:54:34+0530",
            "created_time_formatted": "21/08/2024 02:54 PM",
            "last_modified_time": "2025-01-07T11:25:37+0530",
            "is_viewed_by_client": false,
            "has_attachment": true,
            "client_viewed_time": "",
            "client_viewed_time_formatted": "",
            "is_emailed": false,
            "schedule_time": "",
            "schedule_time_formatted": "",
            "is_square_transaction": false,
            "is_pre_gst": false,
            "unprocessed_payment_amount": 0,
            "unprocessed_payment_amount_formatted": "₹0.00"
        }
    ],
    "page_context": {
        "page": 1,
        "per_page": 200,
        "has_more_page": false,
        "report_name": "Invoices",
        "is_pk_based_query_flow": true,
        "applied_filter": "Status.All",
        "seller_app_sales_channels": "",
        "sort_column": "total",
        "sort_order": "A"
    },
    "instrumentation": {
        "query_execution_time": 0,
        "request_handling_time": 1290,
        "response_write_time": 1959,
        "page_context_write_time": 1,
        "commit_sha": "449db7d8c0aa569be3119f9739685bf6868f77b9",
        "build_url": "https://build.zohocorp.com/zoho/zohobooks/webhost/release/Jan_27_2026_3"
    },
    "developer_assist": {
        "api_summary": {
            "request_start_time": "Wed Jan 28 15:43:24 IST 2026",
            "user_email": "aruneshwar.m@zohotest.com",
            "response_status": "null",
            "X-PRESTIGE-CONNECTION-ID": "null",
            "investigation_id": "null",
            "zoid": "84149182",
            "request_params": {
                "usestate": "true",
                "per_page": "200",
                "requiredfields": "created_time,last_modified_time,date,invoice_number,reference_number,customer_name,status,due_date,total,balance,invoice_id,customer_id,type,due_days,is_emailed,is_viewed_by_client,is_viewed_in_mail,schedule_time,unprocessed_payment_amount,is_peppol_supported,bbps,is_square_transaction,is_digitally_signed,tax_source,is_pre_gst,ach_payment_initiated,client_viewed_time,client_viewed_time_formatted,mail_last_viewed_time,mail_last_viewed_time_formatted,has_attachment,is_correction_invoice",
                "sort_column": "total",
                "organization_id": "77791017",
                "filter_by": "Status.All",
                "page": "1",
                "sort_order": "A"
            },
            "zsid": "84149182",
            "request_uri": "GET /api/v3/invoices",
            "zuid": "77790997",
            "network_stats": {
                "zfs": {
                    "total_time": 0,
                    "total_calls": 0
                },
                "context_switch": 1,
                "others_t": 0,
                "total_network_calls": 50,
                "sql_con_count": 19,
                "redis": {
                    "total_time": 13,
                    "total_calls": 31
                },
                "sql": {
                    "total_calls": 19,
                    "select": 19,
                    "insert": 0,
                    "update": 0,
                    "total_time": 67,
                    "delete": 0,
                    "others": 0
                },
                "sql_con_tt": 31,
                "sql_c_hold": 0,
                "java": {
                    "total_time": 1639,
                    "total_calls": 0
                },
                "kafka": {
                    "total_time": 0,
                    "total_calls": 0
                },
                "http": {
                    "total_calls": 0,
                    "data_space_count": 0,
                    "total_time": 0,
                    "domain_vs_count": {}
                },
                "sql_l_hold": 0,
                "others": 0
            },
            "request_path": "GET : /api/v3/invoices",
            "profiling_summary": {
                "prestige_internal_tt_method": "1527.77",
                "prestige_internal_tt_network": "19.79",
                "total_tm": 287,
                "request_time": "1721.02",
                "prestige_internal_tt_cache": "30.28",
                "prestige_response_construction_took": "33.18",
                "prestige_internal_tt_log": "39.45",
                "ip_address": "172.20.81.133",
                "prestige_internal_tt_toal": "1700.02",
                "prestige_internal_tt_others": "82.71",
                "prestige_internal_tt_cpu": "1679.02",
                "total_cpu_tt": "1673.2"
            },
            "test_id": "null"
        },
        "insights": {
            "iam_api_usage": [
                {
                    "msg": "com.zoho.accounts.AccountsUtil.getCurrentOAuthToken(), URI: /api/v3/invoices",
                    "mt": [
                        {
                            "cnt": "1",
                            "mt": [
                                0,
                                158,
                                159,
                                291,
                                292,
                                293,
                                257,
                                258,
                                259,
                                260,
                                13,
                                261,
                                12,
                                13,
                                262,
                                12,
                                13,
                                263,
                                12,
                                13,
                                235,
                                12,
                                13,
                                236,
                                12,
                                13,
                                237,
                                12,
                                13,
                                229,
                                12,
                                13,
                                208,
                                12,
                                13,
                                193,
                                12,
                                13,
                                194,
                                12,
                                13,
                                12,
                                13,
                                170,
                                12,
                                13,
                                171,
                                12,
                                13,
                                172,
                                12,
                                13,
                                173,
                                12,
                                13,
                                174,
                                12,
                                13,
                                175,
                                176,
                                12,
                                13,
                                177,
                                12,
                                13
                            ]
                        },
                        {
                            "cnt": "1",
                            "mt": [
                                0,
                                158,
                                159,
                                230,
                                231,
                                232,
                                233,
                                234,
                                12,
                                13,
                                235,
                                12,
                                13,
                                236,
                                12,
                                13,
                                237,
                                12,
                                13,
                                229,
                                12,
                                13,
                                208,
                                12,
                                13,
                                193,
                                12,
                                13,
                                194,
                                12,
                                13,
                                12,
                                13,
                                170,
                                12,
                                13,
                                171,
                                12,
                                13,
                                172,
                                12,
                                13,
                                173,
                                12,
                                13,
                                174,
                                12,
                                13,
                                175,
                                176,
                                12,
                                13,
                                177,
                                12,
                                13,
                                178,
                                12,
                                13,
                                112,
                                12,
                                13,
                                80,
                                12,
                                13,
                                81
                            ]
                        },
                        {
                            "cnt": "1",
                            "mt": [
                                0,
                                158,
                                159,
                                230,
                                238,
                                239,
                                240,
                                241,
                                242,
                                12,
                                13,
                                235,
                                12,
                                13,
                                236,
                                12,
                                13,
                                237,
                                12,
                                13,
                                229,
                                12,
                                13,
                                208,
                                12,
                                13,
                                193,
                                12,
                                13,
                                194,
                                12,
                                13,
                                12,
                                13,
                                170,
                                12,
                                13,
                                171,
                                12,
                                13,
                                172,
                                12,
                                13,
                                173,
                                12,
                                13,
                                174,
                                12,
                                13,
                                175,
                                176,
                                12,
                                13,
                                177,
                                12,
                                13,
                                178,
                                12,
                                13,
                                112,
                                12,
                                13,
                                80,
                                12,
                                13
                            ]
                        },
                        {
                            "cnt": "1",
                            "mt": [
                                0,
                                158,
                                159,
                                160,
                                161,
                                126,
                                110,
                                111,
                                12,
                                13,
                                112,
                                12,
                                13,
                                80,
                                12,
                                13,
                                81,
                                12,
                                13,
                                82,
                                83,
                                12,
                                13,
                                84,
                                12,
                                13,
                                85,
                                12,
                                13,
                                70,
                                12,
                                13,
                                71,
                                72,
                                12,
                                13,
                                12,
                                13,
                                14,
                                12,
                                13,
                                15,
                                12,
                                13,
                                12,
                                13,
                                16,
                                17,
                                18,
                                19,
                                20,
                                21,
                                22,
                                23,
                                24,
                                25,
                                26,
                                27,
                                28,
                                29,
                                30,
                                31,
                                32
                            ]
                        },
                        {
                            "cnt": "1",
                            "mt": [
                                0,
                                158,
                                159,
                                230,
                                231,
                                245,
                                246,
                                12,
                                13,
                                235,
                                12,
                                13,
                                236,
                                12,
                                13,
                                237,
                                12,
                                13,
                                229,
                                12,
                                13,
                                208,
                                12,
                                13,
                                193,
                                12,
                                13,
                                194,
                                12,
                                13,
                                12,
                                13,
                                170,
                                12,
                                13,
                                171,
                                12,
                                13,
                                172,
                                12,
                                13,
                                173,
                                12,
                                13,
                                174,
                                12,
                                13,
                                175,
                                176,
                                12,
                                13,
                                177,
                                12,
                                13,
                                178,
                                12,
                                13,
                                112,
                                12,
                                13,
                                80,
                                12,
                                13,
                                81,
                                12
                            ]
                        }
                    ],
                    "type": ""
                }
            ],
            "slower_response_construction": [
                {
                    "type": "",
                    "msg": "Time taken 2038.8"
                }
            ],
            "security_static_field": [
                {
                    "msg": "com.zoho.finance.security.datahandlers.SecurityAsyncDataProcessor.EXTRA_PARAM_USAGE_DATA_COLLECTION_HANDLER",
                    "diff": "",
                    "type": "com.zoho.finance.security.datahandlers.ExtraParamUsageDataCollectionHandler , Updated fields : []",
                    "time_stamp": "0",
                    "c_type": "SF"
                },
                {
                    "msg": "com.zoho.finance.security.datahandlers.SecurityAsyncDataProcessor.I18N_USAGE_DATA_COLLECTION_HANDLER",
                    "diff": "",
                    "type": "com.zoho.finance.security.datahandlers.I18NUsageDataCollectionHandler , Updated fields : []",
                    "time_stamp": "0",
                    "c_type": "SF"
                },
                {
                    "msg": "com.zoho.finance.security.datahandlers.SecurityAsyncDataProcessor.EXTRA_PARAM_USAGE_DATA_COLLECTION_HANDLER",
                    "diff": "",
                    "type": "com.zoho.finance.security.datahandlers.ExtraParamUsageDataCollectionHandler , Updated fields : []",
                    "time_stamp": "0",
                    "c_type": "SF"
                },
                {
                    "msg": "com.zoho.finance.security.datahandlers.SecurityAsyncDataProcessor.I18N_USAGE_DATA_COLLECTION_HANDLER",
                    "diff": "",
                    "type": "com.zoho.finance.security.datahandlers.I18NUsageDataCollectionHandler , Updated fields : []",
                    "time_stamp": "0",
                    "c_type": "SF"
                },
                {
                    "msg": "com.zoho.finance.security.datahandlers.SecurityAsyncDataProcessor.EXTRA_PARAM_USAGE_DATA_COLLECTION_HANDLER",
                    "diff": "",
                    "type": "com.zoho.finance.security.datahandlers.ExtraParamUsageDataCollectionHandler , Updated fields : []",
                    "time_stamp": "0",
                    "c_type": "SF"
                },
                {
                    "msg": "com.zoho.finance.security.datahandlers.SecurityAsyncDataProcessor.EXTRA_PARAM_USAGE_DATA_COLLECTION_HANDLER",
                    "diff": "",
                    "type": "com.zoho.finance.security.datahandlers.ExtraParamUsageDataCollectionHandler , Updated fields : []",
                    "time_stamp": "0",
                    "c_type": "SF"
                },
                {
                    "msg": "com.zoho.finance.security.datahandlers.SecurityAsyncDataProcessor.I18N_USAGE_DATA_COLLECTION_HANDLER",
                    "diff": "",
                    "type": "com.zoho.finance.security.datahandlers.I18NUsageDataCollectionHandler , Updated fields : []",
                    "time_stamp": "0",
                    "c_type": "SF"
                },
                {
                    "msg": "com.zoho.finance.security.datahandlers.SecurityAsyncDataProcessor.I18N_USAGE_DATA_COLLECTION_HANDLER",
                    "diff": "",
                    "type": "com.zoho.finance.security.datahandlers.I18NUsageDataCollectionHandler , Updated fields : []",
                    "time_stamp": "0",
                    "c_type": "SF"
                },
                {
                    "msg": "com.zoho.finance.security.datahandlers.SecurityAsyncDataProcessor.I18N_USAGE_DATA_COLLECTION_HANDLER",
                    "diff": "",
                    "type": "com.zoho.finance.security.datahandlers.I18NUsageDataCollectionHandler , Updated fields : []",
                    "time_stamp": "0",
                    "c_type": "SF"
                },
                {
                    "msg": "com.zoho.finance.security.datahandlers.SecurityAsyncDataProcessor.I18N_USAGE_DATA_COLLECTION_HANDLER",
                    "diff": "",
                    "type": "com.zoho.finance.security.datahandlers.I18NUsageDataCollectionHandler , Updated fields : []",
                    "time_stamp": "0",
                    "c_type": "SF"
                },
                {
                    "msg": "com.zoho.finance.security.datahandlers.SecurityAsyncDataProcessor.I18N_USAGE_DATA_COLLECTION_HANDLER",
                    "diff": "",
                    "type": "com.zoho.finance.security.datahandlers.I18NUsageDataCollectionHandler , Updated fields : []",
                    "time_stamp": "0",
                    "c_type": "SF"
                },
                {
                    "msg": "com.zoho.finance.security.datahandlers.SecurityAsyncDataProcessor.EXTRA_PARAM_USAGE_DATA_COLLECTION_HANDLER",
                    "diff": "",
                    "type": "com.zoho.finance.security.datahandlers.ExtraParamUsageDataCollectionHandler , Updated fields : []",
                    "time_stamp": "0",
                    "c_type": "SF"
                },
                {
                    "msg": "com.zoho.finance.security.datahandlers.SecurityAsyncDataProcessor.EXTRA_PARAM_USAGE_DATA_COLLECTION_HANDLER",
                    "diff": "",
                    "type": "com.zoho.finance.security.datahandlers.ExtraParamUsageDataCollectionHandler , Updated fields : []",
                    "time_stamp": "0",
                    "c_type": "SF"
                },
                {
                    "msg": "com.zoho.finance.security.datahandlers.SecurityAsyncDataProcessor.EXTRA_PARAM_USAGE_DATA_COLLECTION_HANDLER",
                    "diff": "",
                    "type": "com.zoho.finance.security.datahandlers.ExtraParamUsageDataCollectionHandler , Updated fields : []",
                    "time_stamp": "0",
                    "c_type": "SF"
                },
                {
                    "msg": "com.zoho.finance.security.datahandlers.SecurityAsyncDataProcessor.EXTRA_PARAM_USAGE_DATA_COLLECTION_HANDLER",
                    "diff": "",
                    "type": "com.zoho.finance.security.datahandlers.ExtraParamUsageDataCollectionHandler , Updated fields : []",
                    "time_stamp": "0",
                    "c_type": "SF"
                },
                {
                    "msg": "com.zoho.finance.security.datahandlers.SecurityAsyncDataProcessor.I18N_USAGE_DATA_COLLECTION_HANDLER",
                    "diff": "",
                    "type": "com.zoho.finance.security.datahandlers.I18NUsageDataCollectionHandler , Updated fields : []",
                    "time_stamp": "0",
                    "c_type": "SF"
                },
                {
                    "msg": "com.zoho.finance.security.datahandlers.SecurityAsyncDataProcessor.EXTRA_PARAM_USAGE_DATA_COLLECTION_HANDLER",
                    "diff": "",
                    "type": "com.zoho.finance.security.datahandlers.ExtraParamUsageDataCollectionHandler , Updated fields : []",
                    "time_stamp": "0",
                    "c_type": "SF"
                },
                {
                    "msg": "com.zoho.finance.security.datahandlers.SecurityAsyncDataProcessor.EXTRA_PARAM_USAGE_DATA_COLLECTION_HANDLER",
                    "diff": "",
                    "type": "com.zoho.finance.security.datahandlers.ExtraParamUsageDataCollectionHandler , Updated fields : []",
                    "time_stamp": "0",
                    "c_type": "SF"
                },
                {
                    "msg": "com.zoho.finance.security.datahandlers.SecurityAsyncDataProcessor.I18N_USAGE_DATA_COLLECTION_HANDLER",
                    "diff": "",
                    "type": "com.zoho.finance.security.datahandlers.I18NUsageDataCollectionHandler , Updated fields : []",
                    "time_stamp": "0",
                    "c_type": "SF"
                },
                {
                    "msg": "com.zoho.finance.security.datahandlers.SecurityAsyncDataProcessor.EXTRA_PARAM_USAGE_DATA_COLLECTION_HANDLER",
                    "diff": "",
                    "type": "com.zoho.finance.security.datahandlers.ExtraParamUsageDataCollectionHandler , Updated fields : []",
                    "time_stamp": "0",
                    "c_type": "SF"
                },
                {
                    "msg": "com.zoho.finance.security.datahandlers.SecurityAsyncDataProcessor.EXTRA_PARAM_USAGE_DATA_COLLECTION_HANDLER",
                    "diff": "",
                    "type": "com.zoho.finance.security.datahandlers.ExtraParamUsageDataCollectionHandler , Updated fields : []",
                    "time_stamp": "0",
                    "c_type": "SF"
                },
                {
                    "msg": "com.zoho.finance.security.datahandlers.SecurityAsyncDataProcessor.I18N_USAGE_DATA_COLLECTION_HANDLER",
                    "diff": "",
                    "type": "com.zoho.finance.security.datahandlers.I18NUsageDataCollectionHandler , Updated fields : []",
                    "time_stamp": "0",
                    "c_type": "SF"
                },
                {
                    "msg": "com.zoho.finance.security.datahandlers.SecurityAsyncDataProcessor.EXTRA_PARAM_USAGE_DATA_COLLECTION_HANDLER",
                    "diff": "",
                    "type": "com.zoho.finance.security.datahandlers.ExtraParamUsageDataCollectionHandler , Updated fields : []",
                    "time_stamp": "0",
                    "c_type": "SF"
                },
                {
                    "msg": "com.zoho.finance.security.datahandlers.SecurityAsyncDataProcessor.EXTRA_PARAM_USAGE_DATA_COLLECTION_HANDLER",
                    "diff": "",
                    "type": "com.zoho.finance.security.datahandlers.ExtraParamUsageDataCollectionHandler , Updated fields : []",
                    "time_stamp": "0",
                    "c_type": "SF"
                },
                {
                    "msg": "com.zoho.finance.security.datahandlers.SecurityAsyncDataProcessor.EXTRA_PARAM_USAGE_DATA_COLLECTION_HANDLER",
                    "diff": "",
                    "type": "com.zoho.finance.security.datahandlers.ExtraParamUsageDataCollectionHandler , Updated fields : []",
                    "time_stamp": "0",
                    "c_type": "SF"
                }
            ],
            "duplicate_sql_queries": [],
            "too_many_criteria_row_lookup": [
                {
                    "p": 18,
                    "k": "sql_timeline"
                }
            ],
            "sensitive_object_identified_in_logs": [],
            "cache_deprecated_call": [
                {
                    "msg": "com/zoho/finance/cache/CacheAPI.getFromJVMCache(String,String), URI: /api/v3/invoices",
                    "mt": [
                        {
                            "cnt": "1",
                            "mt": [
                                0,
                                162,
                                163,
                                164,
                                165,
                                166,
                                167,
                                168,
                                183,
                                184,
                                185,
                                186,
                                187,
                                188,
                                189,
                                190,
                                191,
                                192,
                                12,
                                13,
                                193,
                                12,
                                13,
                                194,
                                12,
                                13,
                                12,
                                13,
                                170,
                                12,
                                13,
                                171,
                                12,
                                13,
                                172,
                                12,
                                13,
                                173,
                                12,
                                13,
                                174,
                                12,
                                13,
                                175,
                                176,
                                12,
                                13,
                                177,
                                12,
                                13,
                                178,
                                12,
                                13,
                                112,
                                12,
                                13,
                                80,
                                12,
                                13,
                                81,
                                12,
                                13,
                                82,
                                83,
                                12
                            ]
                        },
                        {
                            "cnt": "1",
                            "mt": [
                                0,
                                162,
                                181,
                                182,
                                167,
                                168,
                                169,
                                266,
                                267,
                                268,
                                254,
                                255,
                                256,
                                257,
                                258,
                                259,
                                260,
                                13,
                                261,
                                12,
                                13,
                                262,
                                12,
                                13,
                                263,
                                12,
                                13,
                                235,
                                12,
                                13,
